,date,date_day,h2
0,-3100,,L'unification des Deux Terres
1,-2800,,L'édification de la pyramide de Saqqarah
2,-2650,,La Grande pyramide de Gizeh
3,-2520,,Khephren prend le pouvoir
4,-2160,,Une Egypte divisée
5,-1850,,Abraham quitte sa terre natale
6,-1675,,L'invasion hyksos
7,-1527,,Le règne dAménophis Ier
8,-1500,,Lîle de Santorin touchée par une éruption cataclysmique
9,-1490,,Hatshepsout prend le pouvoir
10,-1468,,Thoutmosis III prend le pouvoir des Deux Terres
11,-1410,,Aménophis III bâti Louxor
12,-1364,,"Aménophis IV, vers le monothéisme"
13,-1352,,Néfertiti disparaît
14,-1347,,Le règne du jeune Toutankhamon
15,-1304,,Début du règne de Séthi Ier
16,-1294,,La bataille de Kadesh
17,-1250,,Moïse mène les Hébreux hors de lÉgypte
18,-1250,,Ramsès II fait édifier Abou Simbel
19,-1100,,Les Phéniciens installent des comptoirs en Tunisie
20,-1080,,"LÉgypte, en déclin"
21,-997,,David conquiert Jérusalem
22,-968,,"Salomon succède à son père, David"
23,-814,,Fondation de Carthage
24,-776,,Premiers jeux olympiques
25,-753,21 avril,Fondation légendaire de Rome
26,-722,,Les Assyriens chassent les Juifs
27,-660,11 février,Naissance de l'Empire du Japon
28,-605,25 septembre,Un nouveau Roi pour Babylone
29,-597,,Le roi de Babylone sempare du royaume hébreu
30,-593,,Réformes de Solon
31,-586,28 mai,Nabuchodonosor profite d'une éclipse
32,-585,28 mai,Léclipse solaire prévue par Thalès a lieu
33,-565,,Fondation dAlalia
34,-563,,Naissance de Bouddha
35,-539,,Les Perses conquièrent la Mésopotamie
36,-538,,Naissance de la tragédie
37,-535,,Echec de la tentative dinvasion étrusco-carthaginoise en Corse
38,-525,,Bouddha prononce le Sermon de Bénarès
39,-525,,Les Perses conquièrent lÉgypte
40,-514,,Les tyrannoctones poignardent Hipparque
41,-510,,Renversement de la tyrannie athénienne
42,-507,,Naissance de la démocratie athénienne
43,-500,,L'installation des Gaëls
44,-498,,Prise de Sardes
45,-494,,Sac de Milet
46,-490,,Darius détruit Byzance
47,-490,13 septembre,Bataille de Marathon
48,-486,,Mort de Darius Ier
49,-483,,Découverte des mines de Laurion
50,-480,17 septembre,Début de la bataille du Cap d'Artémision
51,-480,29 septembre,Victoire des Grecs à Salamine
52,-480,,Mort de Bouddha
53,-480,juillet,Jonction des troupes Perses
54,-480,19 septembre,Défaite héroïque de Léonidas aux Thermopyles
55,-479,,Le Spartiate Pausanias prend Byzance
56,-479,27 août,Mort de Mardonios à Platées
57,-478,,Formation de la Ligue de Délos
58,-472,,"Eschyle présente ""Les Perses"""
59,-471,,Ostracisme de Thémistocle
60,-464,,Sparte victime d'un séisme et d'une révolte
61,-461,,Révolte des hilotes à Spartes
62,-458,,"Première de ""l'Orestie"""
63,-454,,Le trésor de la ligue de Délos est transféré au Parthénon
64,-451,,Réformes politiques à Athènes
65,-449,,Périclès fait construire le Parthénon
66,-443,,Périclès stratège
67,-438,,Achèvement du Parthénon
68,-431,mai,Sparte envahit l'Attique
69,-430,,"Sophocle écrit ""dipe-roi"""
70,-429,septembre,Mort de Périclès
71,-425,,"Mort d'Hérodote, le père de l'histoire"
72,-425,août,Victoire athénienne à Sphactérie
73,-423,,Aristophane sattaque à Socrate
74,-421,mars,Paix de Nicias
75,-421,,Construction de l'Erechthéion
76,-415,mars,"Euripide présente ""Les Troyennes"""
77,-414,août,Rupture de la paix de Nicias entre Athènes et Sparte
78,-414,mai,Scandale des hermai
79,-414,16 novembre,Désastre de l'Assinaros
80,-411,juin,Instauration du régime des 400
81,-410,mars,Victoire d'Athènes à Cyzique
82,-406,août,Condamnation à mort des stratèges des Arginuses
83,-405,septembre,Lysandre détruit la flotte athénienne
84,-404,22 avril,Chute d'Athènes
85,-399,,Socrate boit la ciguë
86,-388,,Platon se rend auprès de Denys I
87,-387,,Première école de philosophie fondée par Platon
88,-370,,Concile bouddhique de Vaisali
89,-357,21 juillet,Incendie du temple d'Artemis
90,-357,,Byzance entre en guerre pour son indépendance
91,-343,,Aristote est chargé de léducation dAlexandre le Grand
92,-341,,Philippe de Macédoine tente de prendre Byzance
93,-340,,Aristote fonde le Lycée
94,-336,,Alexandre le Grand devient roi de Macédoine
95,-332,,Alexandre le Grand conquiert la Judée
96,-332,,Lentrée dAlexandre le Grand en Égypte
97,-331,1 octobre,Victoire d'Alexandre le Grand à Gaugamèles
98,-326,,Alexandre envahit le Pendjab
99,-324,13 juin,Mort d'Alexandre le Grand 
100,-306,,Épicure ouvre son école du Jardin
101,-305,,Ptolémée se proclame roi dÉgypte
102,-280,,Premiers calculs d'Aristarque de Samos
103,-272,,Prise de Tarente
104,-264,,Début de la première guerre punique
105,-262,,Prise dAgrigente par les Romains
106,-260,,La flotte romaine victorieuse à Mylae
107,-259,,Rome envahit la Corse
108,-256,,La guerre punique sétend en Afrique
109,-249,,IIIe concile bouddhique à Pataliputra
110,-242,,Le bouddhisme se répand à Ceylan
111,-241,,Fin de la première guerre punique
112,-240,,Eratosthène calcule la circonférence de la Terre
113,-219,,Prise de Sagonte par Hannibal
114,-218,,Hannibal lance la deuxième guerre punique
115,-217,23 juin,Victoire dHannibal au lac Trasimène
116,-216,2 août,Victoire d'Hannibal sur les Romains à Cannes
117,-212,,Mort dArchimède
118,-202,19 octobre,Fin de la deuxième guerre punique
119,-196,1 juin,Mort du premier empereur Han
120,-186,,Affaire des Bacchanales
121,-165,,La révolte maccabéenne
122,-149,,Scipion Émilien amorce la troisième guerre punique
123,-146,,Rome annexe la Tunisie
124,-146,,Destruction de Carthage
125,-128,,Hipparque découvre les équinoxes
126,-100,12 juillet,Naissance de Jules César
127,-58,,César annexe la Suisse
128,-57,,Jules César soumet le territoire belge
129,-52,mai,Les Romains s'emparent de Lutèce
130,-49,11 janvier,Jules César traverse le Rubicon
131,-48,9 août,Pompée vaincu par César
132,-48,30 septembre,Assassinat de Pompée
133,-47,1 janvier,Jules César rencontre Cléopâtre
134,-44,10 octobre,Fondation de  Lyon
135,-44,15 mars,Assassinat de Jules César
136,-43,11 novembre,Deuxième triumvirat à Rome
137,-43,7 décembre,Assassinat de Cicéron
138,-42,,Marc Antoine rencontre Cléopâtre
139,-37,,"Hérode le Grand est proclamé ""roi des Juifs"""
140,-31,2 septembre,La bataille navale d'Actium
141,-30,,LÉgypte passe sous la domination romaine
142,-30,15 août,Cléopâtre se suicide
143,-23,1 juillet,Auguste tribun à vie
144,1,,"Ovide entreprend les ""Métamorphoses"""
145,14,19 août,La mort de l'empereur Auguste
146,17,,Ephèse détruite par un séisme
147,30,7 avril,Crucifixion de Jésus
148,30,mai,LAscension du Christ
149,32,,Etienne est lapidé
150,34,,Saul de Tarse se convertit
151,41,24 janvier,Assassinat de Caligula
152,42,,La division de la Mauritanie
153,44,,Paul voyage en Asie Mineure
154,48,,Réunion du concile de Jérusalem
155,50,,Paul repart pour lAsie Mineure
156,54,,Dernier voyage missionnaire de Paul
157,64,13 octobre,Saint Pierre est martyrisé
158,64,19 juillet,Rome ravagée par un incendie
159,68,9 juin,Mort de Néron
160,69,22 décembre,Mort de Vitellius
161,70,8 septembre,Destruction du Temple de Jerusalem
162,73,,La prise de Massada
163,79,24 août,Eruption du Vésuve
164,90,,Domitien bannit les philosophes de Rome
165,98,23 janvier,Trajan devient empereur de Rome
166,112,,Rescrit de Trajan sur les persécutions chrétiennes
167,127,,Ptolémée expose sa théorie géocentrique
168,132,,Bar-Kokhba mène une révolte juive
169,138,10 juillet,Sacre de l'empereur Antonin
170,177,,Persécution des chrétiens de Lyon
171,180,17 mars,Mort de l'Empereur philosophe Marc-Aurèle
172,192,31 décembre,Mort de Commode
173,196,,Septime Sévère ravage la cité de Byzance
174,197,19 février,"Septime Sévère, empereur de Rome"
175,203,,Construction de lHippodrome de Byzance
176,258,,Saint-Denis est décapité à Montmartre
177,258,6 août,Le martyre du pape Sixte II
178,303,,Dioclétien persécute les chrétiens
179,312,28 octobre,Bataille du pont Milvius
180,313,février,Constantin promulgue lédit de Milan
181,324,8 décembre,La création de Constantinople
182,325,20 mai,Le concile de Nicée se réunit
183,330,11 mai,Naissance de Constantinople
184,337,22 mai,Constantin est baptisé sur son lit de mort
185,380,28 février,Théodose Ier promulgue lédit de Thessalonique
186,381,,Premier concile de Constantinople
187,387,,Augustin est baptisé
188,393,,Interdiction des Jeux Olympiques
189,395,17 janvier,Mort de lempereur Théodose Ier
190,395,,LÉgypte byzantine
191,406,31 décembre,Invasions barbares
192,410,24 août,Alaric s'empare de Rome
193,430,28 août,Mort de Saint Augustin
194,435,,L'invasion des Vandales
195,450,20 juin,Attila vaincu en Gaule
196,451,8 octobre,Réunion du concile de Chalcédoine
197,451,,Sainte Geneviève protège Paris d'Attila
198,452,8 juillet,Attila épargne Rome
199,455,2 juin,Rome mise à sac par Genséric
200,461,17 mars,La mort de Saint Patrick
201,476,4 septembre,Chute de l'Empire romain d'Occident
202,487,1 mars,Vengeance de Clovis à Soissons
203,496,25 décembre,Baptême de Clovis
204,499,,La rédaction du « Talmud de Babylone »
205,511,27 novembre,Mort de Clovis
206,526,20 mai,La couronne de l'Orient détruite par un séisme
207,532,18 janvier,Lempereur Justinien réprime la sédition de Nika
208,532,11 janvier,La sédition de Nika à Constantinople
209,533,,Les Byzantins chassent les barbares de Corses
210,533,,Conquête byzantine de la Tunisie
211,536,10 décembre,Justinien prend Rome
212,537,27 décembre,Inauguration de la basilique Sainte Sophie 
213,542,,Constantinople est ravagée par la peste
214,552,,Le Japon découvre le bouddhisme
215,557,14 décembre,Constantinople touchée par un séisme
216,587,28 novembre,Traité d'Andelot
217,594,,Le bouddhisme religion dÉtat au Japon
218,602,27 novembre,L'empereur Byzantin Maurice est décapité
219,610,3 octobre,Héraclius empereur byzantin
220,614,5 mai,Les Perses s'emparent de la Vraie Croix
221,622,16 juillet,Début de l'ère musulmane
222,624,,Mahomet vainc les caravanes qorayshites à Badr
223,627,12 décembre,Victoire d'Héraclius sur les Perses
224,630,,Les tribus croates arrivent en Illyrie
225,630,janvier,Mahomet conquiert La Mecque
226,632,,Abou Bakr succède à Mohamed
227,632,8 juin,La mort du prophète Mahomet
228,639,19 janvier,Mort de Dagobert Ier
229,642,,La chute dAlexandrie
230,650,,La version définitive du Coran est réalisée
231,657,26 juillet,Bataille de Siffin
232,661,24 janvier,"Mort d'Ali, gendre de Mahomet"
233,670,,Okba ibn Nafi édifie Kairouan
234,674,,Les Arabes assiègent Constantinople
235,680,10 octobre,Le massacre de Kerbela
236,700,,L'islamisation de l'Afrique du Nord
237,711,juillet,Les musulmans à la conquête de l'Espagne
238,714,16 décembre,Mort de Pépin le Jeune
239,717,15 août,Nouveau siège arabe à Constantinople
240,720,,Fondation de labbaye de Saint-Gall
241,722,,La bataille de Covadonga lance la Reconquista
242,732,25 octobre,Charles Martel arrête les arabes à Poitiers
243,741,22 octobre,Mort de Charles Martel
244,747,,Padmasambhava répand le tantrisme au Tibet
245,750,,La troisième dynastie de califes est fondée
246,751,novembre,"Pépin le Bref, roi des Francs"
247,754,28 juillet,Pépin le Bref est une nouvelle fois sacré
248,755,,Pépin le Bref confie la Corse à la papauté
249,756,15 mai,Fondation de l'Emirat de Cordoue
250,768,25 septembre,Mort de Pépin le Bref
251,771,4 décembre,Charlemagne prend le pouvoir
252,778,15 août,Mort de Roland au col de Roncevaux
253,781,,Alcuin se charge de lécole de Charlemagne
254,789,5 février,Idriss Ier fonde le Maroc 
255,793,8 juin,Premières invasions vikings
256,795,,L'invasion scandinave
257,799,,Charlemagne annexe la Dalmatie
258,800,,La dynastie des Aghlabides
259,800,25 décembre,Sacre de Charlemagne
260,809,,Lédification de la ville de Fès
261,814,28 janvier,Mort de Charlemagne
262,819,,Rébellion pannonienne contre les carolingiens
263,827,,Al-Mamoun fait du mutazilisme une croyance dÉtat
264,841,22 juin,Le partage de l'Empire de Charlemagne
265,842,14 février,Serments de Strasbourg
266,843,,Le territoire belge divisé par le traité de Verdun
267,845,,Persécution du bouddhisme en Chine
268,845,22 novembre,Indépendance de la Bretagne
269,846,août,Les Sarrasins pillent la basilique de Saint-Pierre
270,855,,Nouvelle victoire pour le fondateur de la dynastie Croate
271,857,,Jean VIII ou Papesse Jeanne ?
272,874,,Ingólfur Arnarson sinstalle sur lîle d'Islande
273,879,,Branimir est reconnu Prince de Croatie par Jean VIII
274,879,10 avril,Mort de Louis II le Bègue
275,885,28 novembre,Début du siège de Paris par les Normands
276,887,26 août,Séisme dévastateur au Japon
277,888,13 janvier,Mort du roi Charles III le Gros
278,911,20 juillet,Traité de Saint-Clair-sur-Epte
279,922,26 mars,"Al-Hallaj, grand soufi, est supplicié"
280,925,,Tomislav fonde le royaume de Croatie
281,929,7 octobre,Mort de Charles III le Simple
282,930,,Premier rassemblement de lAlthing
283,933,,La Normandie intègre le Cotentin et l'Avranchin
284,936,15 janvier,"Mort du roi de France, Raoul de Bourgogne"
285,942,18 décembre,Assassinat de Guillaume Longue Epée
286,945,,La Normandie accroît son indépendance
287,962,2 février,Création du Saint Empire Romain Germanique
288,962,2 février,Othon Ier couronné empereur
289,969,6 juillet,Fondation du Caire
290,986,2 mars,Mort de Lothaire III
291,986,,Le Groenland est colonisé par Erik le Rouge
292,987,3 juillet,Sacre d'Hugues Capet
293,996,24 octobre,Mort de Hugues Capet
294,1000,,LIslande se christianise
295,1014,23 avril,La bataille de Clontarf
296,1031,,La Normandie acquiert le Vexin et Pontoise
297,1031,,Fin du califat de Cordoue
298,1031,20 juillet,Mort de Robert II Le Pieux
299,1032,,Conrad II sapproprie la Suisse
300,1035,12 novembre,Les Saxons prennent l'Angleterre aux Danois
301,1037,,La Castille sagrandit
302,1047,,Victoire de Guillaume le Conquérant au Val-des-Dunes
303,1050,17 mai,Mort de Guido d'Arezzo
304,1051,,Les Fatimides envahissent la Tunisie
305,1053,,Mariage de Guillaume le Conquérant et de Mathilde de Flandre
306,1055,,Toghroul Beg est reconnu sultan à Bagdad
307,1059,,Nicolas II affaiblit le pouvoir de lempereur
308,1061,,Le règne des Almoravides
309,1062,,L'édification de Marrakech
310,1066,25 décembre,Guillaume le Conquérant devient roi d'Angleterre
311,1066,14 octobre,Bataille d'Hastings
312,1066,14 octobre,Bataille d'Hastings
313,1066,29 septembre,Guillaume le Conquérant envahit l'Angleterre
314,1071,19 août,La défaite des Byzantins à Manzikert
315,1073,22 avril,Grégoire VII pape
316,1076,24 janvier,Querelle des Investitures : le pape est déposé
317,1077,14 juillet,Dédicace de Bayeux
318,1077,,La Corse passe des mains du Pape aux mains de Pise
319,1077,25 janvier,Henri IV se confesse à Canossa
320,1082,,Privilèges commerciaux pour les Vénitiens
321,1084,31 mars,Henri IV de Germanie couronné empereur
322,1085,25 mai,Prise de Tolède par Alphonse VI
323,1087,9 septembre,Mort de Guillaume le Conquérant
324,1094,,Le Cid Campeador prend Valence
325,1095,27 novembre,Le pape déclenche la première croisade
326,1096,1 août,La croisade populaire arrive à Constantinople
327,1098,3 juin,Antioche est prise par les croisés
328,1099,15 juillet,Les croisés prennent Jérusalem
329,1102,,La Croatie intégrée à la Hongrie
330,1106,28 septembre,La Normandie retrouve l'Angleterre à Tinchebray
331,1113,15 février,Lordre des Hospitaliers est reconnu
332,1115,,L'amour d'Abélard pour Héloïse cruellement puni
333,1118,,Prise de Saragosse par Alphonse Ier le Batailleur
334,1122,24 septembre,Signature du Concordat de Worms
335,1128,13 janvier,LOrdre des Templiers est approuvé
336,1133,,Naissance de luniversité dOxford
337,1139,25 juillet,Victoire portugaise sur les musulmans
338,1139,,Le Portugal érigé en royaume
339,1141,,Création d'un lieu de change sur le Grand Pont
340,1144,11 juin,Consécration de la basilique de Saint Denis
341,1144,,« La Diffamation du sang »
342,1145,1 décembre,Le pape appelle à une nouvelle croisade
343,1147,23 mars,"La prise de Marrakech, fin de la dynastie almoravide"
344,1154,19 décembre,Henri Plantagenêt roi d'Angleterre
345,1159,,La lutte entre le sacerdoce et lEmpire
346,1163,,Début de la construction de Notre-Dame de Paris
347,1170,29 décembre,Assassinat de Thomas Becket
348,1173,9 août,La construction de la Tour de Pise
349,1174,25 novembre,Saladin unit l'Egypte et la Syrie
350,1175,,Le traité de Windsor
351,1176,29 mai,Défaite de Frédéric Barberousse à Legnano
352,1176,,Assemblée cathare à Saint-Félix-de-Caraman
353,1176,,"Chrétien de Troyes compose ""Yvain ou le Chevalier au lion"""
354,1179,1 novembre,Sacre de Philippe Auguste
355,1187,2 octobre,Saladin sempare de Jérusalem
356,1187,29 octobre,Appel à une troisième croisade
357,1189,3 septembre,"Sacre de Richard ""Coeur de lion"""
358,1189,6 juillet,Mort du premier souverain Plantagenêt d'Angleterre
359,1190,10 juin,Barberousse meurt noyé
360,1190,,Le « Guide des égarés » de Maïmonide
361,1190,,Construction du Louvre
362,1191,,Eisai fonde la secte Rinzai au Japon
363,1192,21 août,Création du shogunat
364,1192,janvier,Richard Cur de Lion renonce à Jérusalem
365,1193,4 mars,Mort du sultan Saladin
366,1194,10 juin,La cathédrale de Chartres incendiée
367,1195,,Averroès en exil
368,1195,,Gènes sinstalle à Bonifacio
369,1195,19 juillet,Défaite chrétienne à Alarcos
370,1198,8 janvier,Election du pape Innocent III
371,1199,6 avril,Mort de Richard Cur de Lion
372,1199,25 mars,"La bulle ""Vergentis in senium"" annonce l'Inquisition"
373,1200,30 août,Jean sans Terre enlève et épouse Isabelle d'Angoulême
374,1200,,Naissance de la civilisation inca
375,1200,15 janvier,Création de l'université de Paris
376,1203,17 juillet,Les croisés prennent Constantinople
377,1204,18 juin,La Normandie redevient française
378,1206,,Qûtb ud-Dîn Aibak fonde le sultanat de Dehli
379,1208,15 janvier,Assassinat de Pierre de Castelnau
380,1209,22 juillet,Massacre de Béziers
381,1212,16 juillet,Bataille de Las Navas de Tolosa
382,1212,,Une foule denfants part en croisade
383,1214,27 juillet,Victoire française à Bouvines
384,1215,30 novembre,Clôture du IVe concile du Latran
385,1215,15 juin,La Magna Carta 
386,1215,juin,La croisade contre les albigeois à Toulouse
387,1218,25 juin,Simon de Montfort tué par une pierre
388,1223,14 juillet,Mort de Philippe II Auguste
389,1226,29 novembre,Sacre de Louis IX
390,1226,8 novembre,Mort de Louis VIII
391,1227,18 août,La mort de Gengis Khan
392,1229,11 février,Frédéric II signe le traité de Jaffa
393,1229,12 avril,Fin de la croisade contre les albigeois
394,1231,février,La création de l'Inquisition
395,1233,20 avril,L'Inquisition débute en France
396,1236,,"Les Hafsides de Tunisie, vers lindépendance"
397,1237,,Fondation de Berlin
398,1239,13 mai,Le bûcher de l'Inquisition sévit au Mont-Aimé
399,1240,mars,Les pères de l'Abbaye de Leffe rachètent une Brasserie voisine
400,1241,,Invasion tatare de Cracovie
401,1241,11 avril,Ecrasante victoire Mongole en Hongrie
402,1242,30 octobre,Signature de la paix de Lorris
403,1244,16 mars,Les Cathares capitulent à Montségur
404,1245,17 juillet,Le pape Innocent IV dépose Frédéric II
405,1248,26 avril,Consécration de la Sainte-Chapelle
406,1250,6 avril,Saint Louis fait prisonnier
407,1252,,"La ""quaestio"" légitimée par la bulle ""Ad extirpenda"""
408,1253,,Fondation de la secte japonaise de Nichiren
409,1254,7 septembre,Saint Louis rentre de croisade
410,1257,,Robert de Sorbon fonde un collège
411,1258,10 février,Les mongols anéantissent Bagdad
412,1261,25 juillet,Michel VIII Paléologue prend Constantinople aux croisés
413,1262,,LIslande passe aux mains de la Norvège
414,1269,,La dynastie des Mérinides
415,1270,25 août,Saint-Louis s'éteint à Tunis
416,1271,,Départ de Marco Polo vers la Chine
417,1282,30 mars,Tragiques vêpres siciliennes
418,1284,6 août,Bataille de Meloria
419,1286,6 janvier,Sacre de Philippe IV le Bel
420,1290,12 juillet,Les Juifs sont chassés dAngleterre
421,1291,1 août,Le serment du Grütli
422,1291,28 mai,Les croisés perdent la Terre sainte
423,1294,13 décembre,Le pape Célestin V démissionne
424,1297,,Le Pape confie la Corse à la maison dAragon
425,1297,8 janvier,Les Grimaldi arrivent à Monaco
426,1302,18 mai,"Les ""Mâtines de Bruges"""
427,1302,11 juillet,Bataille des Eperons d'or
428,1303,7 septembre,Arrestation du pape Boniface VIII sous Philippe IV le Bel
429,1305,23 août,Exécution de William Wallace
430,1307,13 octobre,L'arrestation des Templiers
431,1307,,Fusion de Cölln et Berlin
432,1309,9 mars,Le Saint-Siège s'établit en Avignon
433,1314,19 mars,Le Templier Jacques de Molay sur le bûcher
434,1314,29 novembre,Mort de Philippe le Bel 
435,1315,15 novembre,La bataille de Morgarten
436,1315,19 mars,La Charte aux Normands
437,1321,,"Traité ""Ars Nova"" de Philippe de Vitry"
438,1322,3 janvier,Mort de Philippe V
439,1324,8 janvier,Mort de Marco Polo
440,1327,6 avril,Pétrarque rencontre Laure de Noves
441,1328,1 février,Mort de Charles IV le Bel
442,1336,26 avril,Lascension de Pétrarque
443,1336,4 juillet,La Bataille de Minatogawa
444,1336,9 août,Création du Collège de Hubant
445,1336,24 janvier,Mort d'Alphonse IV d'Aragon
446,1336,23 avril,Naissance d'Olivier V de Clisson
447,1336,8 avril,Naissance de Tamerlan
448,1337,,Mort de Kanga Moussa
449,1337,8 janvier,Mort de Giotto di Bondone
450,1337,7 juin,Mort de Guillaume Ier de Hainaut
451,1337,25 juin,Mort de Frédéric II de Sicile
452,1337,7 octobre,Début de la guerre de Cent Ans
453,1337,28 décembre,Révolution dans le Comté de Flandre
454,1338,17 mai,Proclamation du manifeste Fidem Catholicam par Louis IV de Bavière
455,1338,21 janvier,Naissance de Charles V
456,1338,3 janvier,Jacob van Artevelde prend le contrôle de l'insurrection des Gantois
457,1338,,Instauration du Shogunat Ashikaga
458,1338,,La peste noire se propage en Asie
459,1339,23 juillet,Naissance de Louis Ier d'Anjou
460,1339,12 mai,Fondation de l'Université de Grenoble
461,1339,21 juin,La Bataille de Laupen
462,1339,16 août,Mort d'Azzon Visconti
463,1339,23 septembre,Simone Boccanegra devient le premier Doge de Gênes
464,1340,1 avril,Assassinat de Gérard III de Holstein
465,1340,23 juin,La Bataille navale de l'Écluse
466,1340,25 septembre,La Trêve d'Esplechin-sur-Escaut
467,1340,23 janvier,Édouard III d'Angleterre prend le titre de Roi de France à Gand
468,1340,31 mars,Mort de Ivan Ier de Russie
469,1341,15 juin,Mort de Andronic III Paléologue
470,1341,7 septembre,Philippe VI soutient Charles de Blois pour la succession du duché de Bretagne
471,1341,8 avril,Couronnement des Lauriers d'Apollon de Pétrarque
472,1341,30 avril,Mort de Jean III de Bretagne
473,1341,7 septembre,Jean Le Bon envahit la Bretagne
474,1342,15 septembre,Couronnement de Louis Ier de Sicile
475,1342,21 juillet,Début du règne de Louis Ier de Hongrie
476,1342,octobre,Couronnement du Roi Constantin IV d'Arménie
477,1342,juin,La révolution des Zélotes à Thessalonique
478,1342,19 mai,Clément VI est élu pape
479,1343,3 septembre,Fondation de l'Université de Pise
480,1343,23 septembre,Mort de Philippe III de Navarre
481,1343,20 janvier,Mort de Robert Ier de Naples
482,1343,20 janvier,Jeanne Ire de Naples devient Reine de Naples
483,1343,8 juillet,Signature du Traité de Kalisz
484,1344,16 juillet,Fin du Royaume de Majorque indépendant
485,1344,,Varsovie devient la capitale du duché de Mazovie
486,1344,21 novembre,Début de la construction de la Cathédrale Saint-Guy de Prague
487,1344,31 décembre,Mort d'Otto Ier de Poméranie-Stettin
488,1344,9 juillet,Mort de Simone Martini
489,1345,,Olgierd se déclare Grand-prince de Lituanie
490,1345,11 juin,Mort d'Alexis Apokaukos
491,1345,24 juillet,Assassinat de Jacob van Artevelde
492,1345,26 septembre,Mort de Jean de Montfort
493,1345,18 septembre,Assassinat d'André Ier de Naples
494,1346,29 août,Le Danemark vend l'Estonie à l'Ordre Teutonique
495,1346,17 octobre,David II d'Écosse envahit l'Angleterre
496,1346,26 août,Défaite des Français à Crécy
497,1346,4 septembre,Début du Siège de Calais
498,1346,16 avril,Couronnement d'Étienne Douchan
499,1346,,Gènes et la maison dAragon se disputent la Corse
500,1347,1 janvier,Mort de Gasbert de Valle
501,1347,11 octobre,Mort de Louis IV du Saint-Empire
502,1347,3 août,Calais se rend au roi d'Angleterre
503,1347,18 juin,La Bataille de La Roche-Derrien
504,1347,31 mai,Couronnement de Jean VI Cantacuzène
505,1347,novembre,Marseille envahie par la peste noire
506,1347,,La peste devient une arme
507,1348,,Fondation de l'Ordre de la Jarretière
508,1348,,Mort de Giovanni Villani
509,1348,15 septembre,Les Juifs de Chillon sont accusés d'avoir empoisonné les puits
510,1348,8 mars,Fondation de la nouvelle ville de Prague
511,1348,11 avril,Naissance d'Andronic IV Paléologue
512,1348,10 avril,La Bataille de Kairouan
513,1349,18 juin,Création de l'Ordonnance des Travailleurs
514,1349,3 avril,Mort de Guillaume d'Ockham
515,1349,24 janvier,Mort de Lucien Visconti
516,1349,25 octobre,Fin du Royaume de Majorque
517,1349,6 octobre,Début du règne de Charles II de Navarre
518,1350,22 août,Mort de Philippe VI de France
519,1350,22 août,Début du règne de Jean II de France
520,1350,26 mars,Début du règne de Pierre Ier de Castille
521,1350,26 septembre,Sacre à Reims de Jean II de France
522,1350,29 août,La Bataille de L'Espagnols sur Mer
523,1351,,Naissance de Casimir IV de Poméranie
524,1351,25 mars,Combat des Trente
525,1351,20 juillet,Mort de Boleslas III de P?ock
526,1351,14 septembre,Winrich von Kniprode est élu Grand-Maître de l'Ordre Teutonique
527,1351,,Début de la Révolte des Turbans rouges en Chine
