,date,date_day,h2
2283,1672,20 août,Massacre des frères Jean et Cornelis de Witt à la Haye au cours d'une émeute populaire orangiste.
2284,1672,6 avril,"Début de la Guerre de Hollande entre la France et les Provinces-Unies préparée par Hugues de Lionne, non déclarée, juste annoncée par Louis XIV (fin en 1678)"
2285,1672,28 mars,Troisième Guerre anglo-néerlandaise
2286,1672,,"Colonie du Cap : Guerre des Boers contre les Hottentots, qui sont vaincus (fin en 1677)"
2287,1672,,Mulay Ismaïl monte sur le trône marocain
2288,1672,18 décembre,Règne effectif de Charles XI de Suède
2289,1672,9 juin,"Pierre Ier de Russie, tsar de 1682 à 1725"
2290,1673,17 novembre,"Micha? Wi?niowiecki, roi de Pologne, (Né le 31 juillet 1640)"
2291,1673,29 mars,Test Act qui prétend exclure les non-anglicans de toutes fonctions administratives ou militaires. Il reste en vigueur jusqu'en 1828. Le duc d'York doit abandonner sa charge d'amiral.
2292,1673,16 avril,Grenville devient le huitième Premier ministre du Royaume-Uni
2293,1673,1 juin,"Louise Françoise de Bourbon, Mlle de Nantes, fille bâtarde de Louis XIV et de Madame de Montespan"
2294,1673,8 novembre,Colbert fonde la Compagnie du Sénégal
2295,1673,11 novembre,Les Polonais de Jean Sobieski défont les Ottomans à la bataille de Khorzim (Khotine)
2296,1673,,"Sanay, roi birman de la dynastie Taungû (mort en 1714)"
2297,1673,15 février,Signature du traité de Hubertusburg sur la Silésie entre Prusse et Autriche
2298,1673,17 février,Mort de Jean-Batiste Poquelin
2299,1673,31 août,Rio de Janeiro devient capitale du Brésil
2300,1673,30 août,Traités de La Haye : l'Empereur Léopold Ier et l'Espagne s'allient aux Provinces-Unies contre la France. Rupture entre l'empereur et la France.
2301,1673,21 août,Combat naval au Texel. Victoire de la Hollande (De Ruyter) contre la flotte franco-britannique
2302,1673,29 juin,Prise de Maastricht par la France
2303,1673,25 juin,"Charles de Batz, sieur d'Artagnan est tué au cours du siège de Maastricht"
2304,1673,mars,"Narawara, roi birman de la dynastie Taungû (né en 1650)"
2305,1673,3 octobre,"Mort d'Auguste III, roi de Pologne"
2306,1673,21 novembre,James Murray devient le premier gouverneur de la province britannique de Québec
2307,1674,8 novembre,"John Milton, poète anglais"
2308,1674,décembre,Suppression de la Compagnie française des Indes Occidentales : l'Amérique française est rattachée au domaine royal.
2309,1674,24 octobre,"Charles-François d'Hallencourt de Dromesnil, comte de Verdun, cardinal et prince du Saint Empire"
2310,1674,22 février,"Jean Chapelain, poète et critique (Paris, 1595-1674)"
2311,1674,avril,Hôtel des Invalides
2312,1674,21 mai,Jean Sobieski (Jan) est élu roi de Pologne sous le nom de Jean III de Pologne (fin en 1696).
2313,1674,6 juin,Chhatrapati Shivaji fonde l'empire des Maratha en Inde (fin de règne en 1680)
2314,1674,12 août,"Philippe de Champaigne, peintre belge"
2315,1674,11 août,"Victoire indécise et sanglante de Condé à la bataille de Seneffe, près de Charleroi, sur les troupes hispano-hollando-impériales qui tentaient de descendre vers les Pays-Bas du Sud"
2316,1675,11 novembre,Le neuvième gurû sikh Teg Bahdur est assassiné par l'empereur Aurangzeb. Gurû Gobind Singh devient le dixième et dernier gurûs du sikhisme
2317,1675,5 juin,Jacques Duchesneau de la Doussinière et d'Ambault devient intendant de Nouvelle-France
2318,1675,8 juillet,"Début de la « Guerre du roi Philippe » contre les Indiens, au Massachusetts (1675-1676)"
2319,1675,15 décembre,"Johannes Vermeer, peintre hollandais (Né en 1632)"
2320,1675,11 août,Le maréchal François de Créquy est vaincu par les impériaux à la bataille de Consarbrück
2321,1675,27 juillet,Turenne est tué par un boulet à la bataille de Salzbach après avoir franchi le Rhin
2322,1675,,Révolte des Bonnets rouges en Bretagne.
2323,1675,25 mars,L'affaire des poisons
2324,1675,16 janvier,"Louis de Rouvroy, duc de Saint-Simon, écrivain français, célèbre pour ses Mémoires. (décès le 2 mars 1755)"
2325,1675,5 janvier,"Bataille de Turckheim, en Alsace, gagnée par le maréchal de Turenne contre les impériaux"
2326,1675,15 décembre,Mort de Vermeer
2327,1676,,Victoire de Jean Sobieski sur les Turcs à Juravno en Ukraine. Il impose la restitution d'une partie de l'Ukraine à la Pologne
2328,1676,,Première mesure de la vitesse de la lumière
2329,1676,21 septembre,Début du pontificat d'Innocent XI (fin en 1689)
2330,1676,14 janvier,"Pier Francesco Cavalli, compositeur et organiste italien (Crema, 1602 - Venise, 1676), maître de chapelle à Saint-Marc, auteur de 45 opéras"
2331,1676,29 juin,Les Danois envahissent Helsingborg. Début de la Guerre de Scanie entre la Suède et le Danemark (1676-1679). La Suède ne sera sauvée que par son allié français Louis XIV
2332,1676,29 janvier,Début du règne du tsar Fédor III de Russie (fin en 1682)
2333,1676,29 avril,De Ruyter
2334,1676,juin,Début de la révolte de Nathaniel Bacon en Virginie
2335,1676,2 juin,Abraham Duquesne est vainqueur dans le golfe de Palerme
2336,1676,19 octobre,"Mort de Fazil Ahmet Köprülü. Kara Mustafa, devient grand vizir de l'Empire ottoman (fin en 1689)"
2337,1676,8 janvier,Bataille d'Alicudi
2338,1677,14 juillet,Victoire suèdoise sur les Danois et le Brandebourg à la bataille de Landskrona
2339,1677,20 avril,"Mathieu Le Nain peintre français, à Paris3"
2340,1677,20 octobre,"Stanislas Leszczynski, roi de Pologne (décès le 23 février 1766)"
2341,1677,21 février,"Baruch Spinoza, philosophe"
2342,1677,11 avril,"Bataille de la Peene, aussi appelée bataille de Cassel, Philippe de France et Luxembourg défont Guillaume d'Orange"
2343,1677,9 octobre,Victoire de Créquy sur le duc de Lorraine à la bataille de Kokersberg
2344,1677,23 janvier,Don Juan d'Autriche (1629-1679) entre dans Madrid en compagnie de dix-huit Grands et s'empare du pouvoir en Espagne
2345,1677,4 mai,"Isaac Barrow, mathématicien anglais"
2346,1677,,Guerre entre la Russie et l'Empire ottoman
2347,1677,17 septembre,"Stephen Hales, physiologiste, chimiste et inventeur anglais"
2348,1677,1 janvier,"Racine présente ""Phèdre"""
2349,1678,6 septembre,Popish Plot
2350,1678,14 août,Bataille de Saint-Denis
2351,1678,12 juillet,"Mort d'Antoine III, duc de Gramont"
2352,1678,14 avril,Naissance d'Abraham Darby
2353,1678,,?erban Ier Cantacuzino devient prince de Valachie
2354,1678,,Charles Le Brun décore la galerie des Glaces
2355,1678,10 août,Signature du traité de Nimègue
2356,1678,18 octobre,Mort de Jacob Jordaens
2357,1678,4 mars,Naissance d'Antonio Vivaldi
2358,1679,5 février,Paix de Nimègue
2359,1679,4 décembre,Mort de Thomas Hobbes
2360,1679,12 octobre,Simon van der Stel devient commandeur de la colonie du Cap
2361,1679,27 mai,L'habeas corpus est adopté
2362,1679,17 septembre,Décès de Don Juan José d'Autriche
2363,1679,15 mai,Crise de l'Exclusion Bill
2364,1679,22 septembre,Robert Knox s'évade de Ceylan
2365,1679,15 avril,Décès de Madame de Longueville
2366,1679,23 février,Mort de Jan Steen
2367,1679,30 septembre,Naissance de Jacques Cassard
2368,1680,17 mars,Décès de La Rochefoucauld.
2369,1680,28 novembre,Décès de Gian Lorenzo Bernini.
2370,1680,3 avril,Décès de Fouquet.
2371,1680,22 juillet,Décès de Richard Cameron.
2372,1680,21 octobre,Naissance de la Comédie-Française
2373,1680,1 octobre,Décès de Pierre-Paul Riquet.
2374,1680,25 août,Décès de Siméon de Polotsk.
2375,1680,19 août,Décès de Jean Eudes.
2376,1680,3 avril,Décès de Shivâjî Bhonsla.
2377,1680,9 avril,Naissance de Philippe Néricault Destouches.
2378,1681,,Jules Hardouin-Mansart est nommé premier architecte du roi de France.
2379,1681,6 mars,Décès de Michel de Marolles.
2380,1681,28 juin,Décès de Mademoiselle de Fontanges.
2381,1681,6 août,Décès de Nikon.
2382,1681,12 août,Naissance de Vitus Béring
2383,1681,30 septembre,Bataille du cap Saint-Vincent.
2384,1682,19 mars,Déclaration des quatre articles.
2385,1682,,Début du règne de Pierre Ier le Grand.
2386,1682,,Edmund Halley observe sa comète
2387,1682,31 mars,Avvakoum et ses disciples subissent le supplice du feu.
2388,1682,14 mars,Décès de Jacob Van Ruysdael.
2389,1682,11 mai,Révolte des streltsy.
2390,1682,14 août,Imre Thököly prend la ville de Ko¨ice.
2391,1682,9 avril,Cavelier de La Salle offre la Louisiane à Louis XIV
2392,1682,3 avril,Décès de Bartolomé Esteban Murillo.
2393,1682,27 octobre,William Penn fonde Philadelphie.
2394,1682,6 août,Naissance du duc de Bourgogne.
2395,1682,6 mai,Louis XIV s'installe à Versailles
2396,1682,19 juillet,Début du règne de Iyasou le Grand.
2397,1683,25 décembre,Exécution du grand vizir Kara Mustafa
2398,1683,10 novembre,Naissance de Georges II de Grande-Bretagne
2399,1683,9 octobre,Louis XIV épouse Madame de Maintenon
2400,1683,12 septembre,Les Turcs repoussés devant Vienne
2401,1683,6 septembre,Mort de Colbert
2402,1683,30 juillet,Décès de Marie-Thérèse d'Autriche
2403,1683,,Début de la cinquième guerre austro-turque
2404,1683,1 janvier,Fondation de la Côte de l'Or brandebourgeoise
2405,1683,15 janvier,Décès de Guillaume Lamy
2406,1683,12 septembre,Début du règne de Pierre II de Portugal
2407,1683,28 février,Naissance de René-Antoine Ferchault de Réaumur
2408,1683,25 septembre,Naissance de Jean-Philippe Rameau
2409,1683,12 juin,Le Rhye House Plot est découvert
2410,1684,4 janvier,Décès de Louis-Isaac Lemaistre de Sacy
2411,1684,24 février,Révolte de Beckman au Brésil
2412,1684,19 mars,Naissance de Jean Astruc
2413,1684,2 mai,La Fontaine entre à l'Académie française
2414,1684,8 mai,Décès de Henry Du Mont
2415,1684,22 juin,Naissance de Francesco Manfredini
2416,1684,15 août,Trêve de Ratisbonne
2417,1684,16 juin,Prise de Visegrád par les Autrichiens
2418,1684,1 octobre,Mort de Pierre Corneille
2419,1684,10 octobre,Naissance d'Antoine Watteau
2420,1684,13 juin,Inauguration de la machine de Marly
2421,1684,28 avril,Siège de Luxembourg par Louis XIV
2422,1685,6 juillet,Bataille de Sedgemoor
2423,1685,1 août,Jacques-René de Brizay devient gouverneur de la Nouvelle-France
2424,1685,1 octobre,Naissance de Charles VI du Saint-Empire
2425,1685,18 octobre,Louis XIV révoque l'Edit de Nantes
2426,1685,6 décembre,Naissance de Marie-Adélaïde de Savoie
2427,1685,23 février,Naissance de Georg Friedrich Haendel
2428,1685,12 mars,Naissance de George Berkeley
2429,1685,,Construction de la place Vendôme
2430,1685,21 mars,Naissance de Johann Sebastian Bach
2431,1685,23 avril,Couronnement de Jacques II d'Angleterre
2432,1685,,Construction du pont Royal
2433,1686,6 juillet,Naissance du botaniste Antoine de Jussieu
2434,1686,2 septembre,Les turcs chassés de Buda
2435,1686,26 novembre,Mort de Niels Stensen
2436,1686,9 juillet,La ligue d'Augsbourg
2437,1686,20 juin,La Bataille de la Baie James
2438,1686,11 décembre,Mort de Louis II de Bourbon-Condé
2439,1686,juin,"Madame de Maintenon crée une école de filles, Saint-Cyr"
2440,1686,6 mai,Le traité de paix éternelle
2441,1686,21 janvier,Mort de l'architecte français François Blondel
2442,1686,,Construction du Grand Trianon et de l'Orangerie du château de Versailles
2443,1687,20 novembre,Mort d'Olivier Charbonneau
2444,1687,8 novembre,Début du sultanat de Soliman II
2445,1687,28 janvier,Mort de Johannes Hevelius
2446,1687,12 août,La Bataille de Mohács
2447,1687,22 mars,Mort de Jean-Baptiste Lully
2448,1687,19 mars,Assassinat de René Robert Cavelier de La Salle
2449,1687,19 mars,Assassinats de René Robert Cavelier de La Salle
2450,1687,27 janvier,La querelle des Anciens et des modernes
2451,1687,26 novembre,Le Parthénon endommagé par une explosion
2452,1687,9 décembre,"Couronnement de Joseph Ier du Saint-Empire, roi de Hongrie"
2453,1687,16 décembre,Mort de William Petty
2454,1687,3 février,Mort de François de Blanchefort de Créquy de Bonne
2455,1687,,Isaac Newton publie les « Principes mathématiques de philosophie naturelle »
2456,1688,,Exploration de l'Australie par William Dampier
2457,1688,4 février,Naissance de Pierre Carlet de Chamblain de Marivaux
2458,1688,mars,"Parution des ""Caractères"" de la Bruyère"
2459,1688,7 juillet,Le problème de Molyneux
2460,1688,11 juillet,"Mort de Narai le Grand, roi du Siam"
2461,1688,25 septembre,Guerre de la Ligue des Augsbourg
2462,1688,9 octobre,Mort du médecin et architecte français Claude Perrault
2463,1688,28 octobre,"Constantin II Brancovan, prince de Valachie"
2464,1688,5 novembre,Guillaume dOrange débarque en Angleterre
2465,1688,9 mai,Mort de Frédéric-Guillaume Ier de Brandebourg
2466,1688,16 août,Naissance de Gaspard de Clermont-Tonnerre
2467,1689,5 août,Massacre de Lachine
2468,1689,juillet,Retour de François Vivent en Languedoc
2469,1689,17 mai,Déclaration de guerre de Guillaume III d'Angleterre
2470,1689,6 septembre,Traité de Nertchinsk
2471,1689,27 juillet,Bataille de Killiecrankie
2472,1689,13 février,Guillaume III dOrange est proclamé roi dAngleterre
2473,1689,6 octobre,Début du pontificat d'Alexandre VIII
2474,1689,11 mai,Bataille de la baie de Bantry
2475,1689,22 mars,Débarquement de Jacques II d'Angleterre à Kinsale
2476,1689,18 janvier,Naissance de Montesquieu
2477,1689,,Henry Purcell présente Didon et Enée
2478,1690,11 juillet,Victoire française à la bataille navale de cap Béveziers
2479,1690,30 avril,Fin de la rébellion jacobite à la bataille de Cromdale
2480,1690,1 juillet,La bataille de la Boyne
2481,1690,24 janvier,Joseph de Habsbourg est élu roi des Romains
2482,1690,septembre,Voyage d'Engelbert Kaempfer au Japon
2483,1690,16 octobre,Victoire française à la bataille de Québec
2484,1690,18 août,Victoire française à la bataille de Staffarda
2485,1691,10 avril,Fin du siège de Mons
2486,1691,12 juillet,Election d'Innocent XII
2487,1691,12 juillet,Elections d'Innocent XII
2488,1691,23 juin,Début du règne d'Ahmet II
2489,1691,16 juillet,Mort de Louvois
2490,1691,18 septembre,Bataille de Leuze
2491,1691,13 janvier,Mort de George Fox
2492,1691,3 octobre,Signature du traité de Limerick
2493,1691,19 août,Bataille de Slankamen
2494,1691,16 mai,Exécution de Jacob Leisler
2495,1691,30 décembre,Décès de Robert Boyle
2496,1691,19 octobre,Décès d'Isaac de Benserade
2497,1692,13 février,Massacre de Glen Coe
2498,1692,14 août,Décès de Nicolas Chorier
2499,1692,3 août,Bataille de Steinkerque
2500,1692,23 juillet,Décès de Gilles Ménage
2501,1692,30 juin,Siège de Namur
2502,1692,29 mai,Bataille de Barfleur
2503,1692,1 mars,Arrestation des sorcières de Salem
2504,1692,6 novembre,Décès de Gédéon Tallemant des Réaux
2505,1692,29 octobre,Décès de Melchisédec Thévenot
2506,1693,25 mai,Décès de Madame de Lafayette
2507,1693,15 juin,Discours de la Bruyère à lAcadémie française
2508,1693,29 juillet,Bataille de Neerwinden
2509,1693,4 octobre,Bataille de La Marsaille
2510,1693,7 février,Décès de Paul Pellisson
2511,1693,5 avril,Décès d'Anne Marie Louis d'Orléans
2512,1693,avril,Création de l'Ordre royal et militaire de Saint-Louis
2513,1693,7 février,Naissance d'Anne Ière de Russie
2514,1693,8 février,Fondation du College of William and Mary
2515,1693,11 janvier,Tremblement de terre en Sicile
2516,1693,23 janvier,Naissance de Georg Bernhard Bilfinger
2517,1694,28 décembre,Décès de Marie II d'Angleterre
2518,1694,25 juillet,Mort de Moronobu Hishikawa
2519,1694,8 août,Décès d'Antoine Arnauld
2520,1694,2 décembre,Mort de Pierre Puget
2521,1694,27 mai,Bataille de la rivière Ter
2522,1694,22 juillet,Bombardement de Dieppe
2523,1694,17 février,Décès d'Antoinette Des Houlières
2524,1694,4 février,Pierre le Grand commence à régner
2525,1695,11 février,Naissance de Françoise de Graffigny
2526,1695,5 septembre,Capitulation des Français au siège de Namur
2527,1695,13 août,Bombardement de Bruxelles
2528,1695,17 juillet,Fondation de la Banque royale d'Ecosse
2529,1695,8 juillet,Décès de Christian Huygens
2530,1695,30 mai,Décès de Pierre Mignard
2531,1695,13 avril,Mort du plus grand des fabulistes
2532,1695,4 janvier,Décès du maréchal de Luxembourg
2533,1695,6 février,Début du règne de Mustafa II
2534,1695,21 novembre,Décès d'Henry Purcell
2535,1696,,Défaite de Galdan face aux Madchous de Fei-yang-kou
2536,1696,8 février,Décès d'Ivan V de Russie.
2537,1696,17 avril,Décès de Mme de Sévigné.
2538,1696,17 juin,Décès de Jean III Sobieski.
2539,1696,11 mai,Décès de Jean de La Bruyère
2540,1696,18 juillet,Pierre le Grand fonde la Marine impériale de Russie et prend Azov aux Ottomans.
2541,1696,28 octobre,Naissance de Maurice de Saxe.
2542,1696,17 octobre,Naissance d'Auguste III de Saxe.
2543,1697,,Charles Perrault publie les Contes de ma mère l'Oye.
2544,1697,17 février,Naissance de Charles Antoine de La Roche-Aymon.
2545,1697,24 mars,Naissance de Louis Constantin de Rohan.
2546,1697,5 avril,Début du règne de Charles XII.
2547,1697,15 juin,Début du siège de Barcelone.
2548,1697,27 juin,Auguste II le Fort est élu roi de Pologne.
2549,1697,30 octobre,Une partie de Saint-Domingue cédée à la France
2550,1697,10 novembre,Naissance de William Hogarth.
2551,1697,22 novembre,Décès de Libéral Bruant.
2552,1697,4 septembre,Décès de François d'Orbay.
2553,1697,20 septembre,Signature du Traité de Ryswick.
2554,1698,5 septembre,Exécution des Streltsy.
2555,1698,28 septembre,Naissance de  Pierre Louis Maupertuis.
2556,1698,28 novembre,Décès de Louis de Buade de Frontenac.
2557,1698,11 octobre,Traité de La Haye.
2558,1698,4 janvier,Incendie du Palais de Whitehall.
2559,1698,10 janvier,Décès de Louis-Sébastien Le Nain de Tillemont.
2560,1698,14 juin,Décès de Gerrit Berckheyde.
2561,1698,5 septembre,Le tsar Pierre le Grand taxe les barbus
2562,1699,20 avril,Louis-Hector de Callière devient gouverneur de la Nouvelle-France.
2563,1699,15 décembre,Réforme du calendrier en Russie.
2564,1699,2 novembre,Willem Adriaan van der Stel devient gouverneur de la colonie du Cap.
2565,1699,2 novembre,Naissance de Jean Siméon Chardin.
2566,1699,21 avril,Décès de Jean Racine.
2567,1699,17 août,Naissance de Bernard de Jussieu.
2568,1699,26 juin,Naissance de  Marie-Thérèse Rodet Geoffrin.
2569,1699,25 août,Début du règne de Frédéric IV.
2570,1699,27 janvier,Décès de William Temple.
2571,1699,26 janvier,Traité de Karlovci.
2572,1700,30 novembre,Bataille de Narva
2573,1700,,Tremblement de terre de Cascadia
2574,1700,23 novembre,Elections de Clément XI
2575,1700,27 février,Découverte de la Nouvelle-Bretagne par William Dampier
2576,1700,19 novembre,Naissance de Jean Antoine Nollet
2577,1700,16 novembre,Louis XIV désigne son petit-fils roi d'Espagne
2578,1700,1 novembre,Mort de Charles II d'Espagne
2579,1700,10 octobre,Naissance de Lambert Sigisbert Adam
2580,1700,13 juillet,Traité de Constantinople entre la Russie et l'Empire ottoman
2581,1700,,Début de la Seconde Guerre du Nord
2582,1700,23 novembre,Election de Clément XI
2583,1700,15 septembre,Décès d'André Le Nôtre
2584,1701,4 août,Signature de la Grande paix de Montréal
2585,1701,9 juillet,Bataille de Carpi
2586,1701,16 septembre,Décès de Jacques II d'Angleterre
2587,1701,5 janvier,Mort de Louis François Marie Le Tellier
2588,1701,1 septembre,Bataille de Chiari
2589,1701,27 novembre,Naissance d'Anders Celsius
2590,1701,9 juin,Décès de Philippe d'Orléans
2591,1701,18 janvier,Couronnement de Frédéric Ier de Prusse
2592,1701,28 janvier,Naissance de Charles Marie de La Condamine
2593,1701,18 janvier,Naissance du royaume de Prusse
2594,1702,27 mai,Philippe de Rigaud de Vaudreuil devient gouverneur général de Nouvelle-France
2595,1702,8 mars,Décès de Guillaume III d'Angleterre
2596,1702,1 février,Bataille de Crémone
2597,1702,14 octobre,Bataille de Friedlingen
2598,1702,6 janvier,"Fondation de Mobile, en Louisiane"
2599,1702,23 octobre,Bataille de Vigo
2600,1702,15 août,Bataille de Luzzara
2601,1702,29 juillet,Bataille de Hummelshof
2602,1702,14 décembre,Vengeance des 47 rônin
2603,1702,,Abolition du stathoudérat
2604,1702,27 avril,Mort de Jean Bart
2605,1702,29 octobre,Marlborough s'en va t'en guerre
2606,1703,19 novembre,"Mort du ""masque de fer"""
2607,1703,16 mai,Décès de Charles Perrault
2608,1703,31 juillet,Daniel Defoe au pilori
2609,1703,21 août,Ahmet III monte sur le trône de l'Empire ottoman
2610,1703,23 juin,Naissance de Marie Catherine Sophie Félicité Leszczy?ska
2611,1703,22 mai,Bataille du cap de la Roque
2612,1703,31 décembre,Décès de Mustafa II
2613,1703,17 juin,Naissance de John Wesley
2614,1703,16 mai,La fondation de Saint-Petersbourg
2615,1703,mai,François II Rákóczi appelle la Hongrie à se soulever
2616,1703,27 décembre,Signature du traité de Methuen
2617,1703,12 septembre,Couronnement de Charles III d'Espagne
2618,1704,5 septembre,Naissance de Quentin de La Tour
2619,1704,5 février,"Décès de Guillaume François Antoine, marquis de L'Hôpital"
2620,1704,8 juillet,François II Rákóczi devient prince de Transylvanie
2621,1704,28 octobre,Décès de John Locke
2622,1704,12 juillet,"Elections de Stanislas Ier, roi de Pologne"
2623,1704,12 avril,Décès de Jacques-Bénigne Bossuet
2624,1704,24 août,Bataille de Vélez-Málaga
2625,1704,3 septembre,Naissance de Joseph de Jussieu
2626,1704,13 août,Bataille de Blenheim
2627,1704,2 juillet,Bataille de Schellenberg
2628,1705,31 octobre,Naissance du futur pape Clément XIV
2629,1705,9 octobre,Prise de Barcelone
2630,1705,20 septembre,François II Rákóczi devient régent de Hongrie
2631,1705,16 août,Bataille de Cassano
2632,1705,5 mai,Mort de Léopold Ier du Saint-Empire
2633,1705,15 février,Naissance de Carle van Loo
2634,1705,17 janvier,Décès de John Ray
2635,1705,,Assassinats de Sangyé Gyatzo
2636,1705,,Hussein ibn Ali prend le pouvoir tunisien
2637,1705,,Thomas Newcomen construit une machine à vapeur
2638,1705,,Assassinat de Sangyé Gyatzo
2639,1706,14 mai,Début du siège de Turin.
2640,1706,28 décembre,Décès de Pierre Bayle
2641,1706,17 janvier,Naissance de Benjamin Franklin.
2642,1706,17 décembre,Naissance d'Émilie du Châtelet.
2643,1706,9 décembre,Jean V de Portugal devient roi.
2644,1706,10 juin,Naissance de John Dollond.
2645,1706,23 mai,Bataille de Ramillies.
2646,1706,19 avril,Victoire franco-espagnole à la bataille de Calcinato.
2647,1706,13 février,Bataille de Fraustadt.
2648,1707,29 juillet,Siège de Toulon
2649,1707,26 mai,Décès de Madame de Montespan
2650,1707,1 mai,L'Ecosse et l'Angleterre s'unissent
2651,1707,25 avril,Bataille d'Almanza
2652,1707,30 mars,Décès de Vauban
2653,1707,7 mars,Révolte des Tard-Avisés du Quercy
2654,1707,3 mars,Mort d'Aurangzeb
2655,1707,25 février,Naissance de Carlo Goldoni
2656,1707,,Guerre des Emboabas au Brésil
2657,1707,7 septembre,Naissance de Buffon
2658,1707,25 août,Naissance de Louis Ier d'Espagne
2659,1708,28 janvier,Naissance de Jean-François-Joseph de Rochechouart
2660,1708,11 mai,Décès de Jules Hardouin-Mansart
2661,1708,17 mai,Décès de François de Montmorency-Laval
2662,1708,11 juillet,Bataille d'Audenarde
2663,1708,,Kelzang Gyatso est le 7e dalaï-lama
2664,1708,28 septembre,Bataille de Lesnaya
2665,1708,7 octobre,Assassinats de Gurû Gobind Singh
2666,1708,7 octobre,Assassinat de Gurû Gobind Singh
2667,1708,15 novembre,Naissance de William Pitt l'Ancien
2668,1708,28 juillet,Début du siège de Lille
2669,1709,,Première utilisation du coke en métallurgie
2670,1709,15 juin,Naissance de Louis de Bourbon
2671,1709,11 septembre,Bataille de Malpaquet
2672,1709,24 février,Naissance de Jacques de Vaucanson
2673,1709,19 février,Décès du shogun Tokugawa Tsunayoshi
2674,1709,8 juillet,Bataille de la Poltava
2675,1709,29 décembre,Naissance d'Elisabeth Ière de Russie
2676,1709,28 août,Mort d'Ivan Mazepa
2677,1709,31 août,Décès d'Andrea Pozzo
2678,1709,4 septembre,Décès de Jean-François Regnard
2679,1709,27 juillet,Abdication de l'empereur du Japon Higashiyama en faveur de son fils
2680,1710,6 juin,Décès de Louise de La Vallière.
2681,1710,27 juillet,Bataille d'Almenar.
2682,1710,14 mai,Naissance d'Adolphe Frédéric de Suède.
2683,1710,8 décembre,Bataille de Brihuega.
2684,1710,20 août,Bataille de Saragosse.
2685,1710,15 février,Naissance de Louis XV
2686,1710,29 janvier,Alphabet cyrillique officiel en Russie.
2687,1710,4 janvier,Naissance de Giovanni Battista Pergolesi.
2688,1710,,"Dimitrie Kantémir, prince de Moldavie."
2689,1710,16 octobre,Les britanniques prennent Port-Royal et la renomment Annapolis Royal.
2690,1710,28 février,Victoire suédoise à Helsingborg.
2691,1711,17 avril,Mort de Joseph Ier
2692,1711,26 avril,Naissance de David Hume
2693,1711,,LAwu explose
2694,1712,29 janvier,Le sort de la couronne d'Espagne se joue à Utrecht
2695,1712,18 février,Mort du dauphin Louis de France 
2696,1712,24 juillet,Trève franco-hollandaise
2697,1713,11 avril,Les Pays-Bas espagnols passent à lAutriche
2698,1713,11 avril,Fin des négocations à Utrecht
2699,1714,10 octobre,Décès de Boisguillebert.
2700,1714,19 février,Bataille de Storkyro.
2701,1714,5 février,Décès de Carlo Fontana.
2702,1714,3 mars,Traité de Rastatt.
2703,1714,24 mars,Destitution de Constantin II.
2704,1714,6 juin,Naissance de Joseph Ier de Portugal.
2705,1714,17 juin,Naissance de César-François Cassini.
2706,1714,1 août,Début du règne de Georges Ier.
2707,1714,,Décès de Denis Papin.
2708,1715,1 septembre,Le Roi Soleil s'éteint
2709,1715,6 février,Le Portugal obtient la Colonia del Sacramento.
2710,1715,6 septembre,Début du soulèvement en Écosse des jacobites.
2711,1715,30 septembre,Naissance d'Étienne Bonnot de Condillac.
2712,1715,13 octobre,Décès de Nicolas Malebranche.
2713,1715,15 novembre,Troisième traité de la Barrière.
2714,1715,22 décembre,Arrivée de Giuseppe Castiglione à Pékin.
2715,1715,14 septembre,Décès de Dom Pérignon.
2716,1716,2 mai,John Law fonde la Banque générale
