,date,date_day,h2
975,1437,25 mars,Couronnement de Jacques II d'Ecosse
976,1437,12 novembre,Entrée dans Paris de Charles VII
977,1438,18 mars,Election d'Albert II de Habsbourg en tant que roi des Romains
978,1438,8 janvier,Ouverture du concile de Ferrare-Florence
979,1438,13 septembre,"Début du règne d'Alphonse V l'Africain, roi du Portugal"
980,1438,27 octobre,Début du règne de Christophe III du Danemark
981,1438,31 mai,Couronnement d'Albert II de Habsbourg à Aix-la-Chapelle
982,1438,,Début du règne du chef turkmène Jihân Chah
983,1438,7 juillet,"Publication de la ""Pragmatique sanction"""
984,1438,,Inca Yupanqui défend sa cité
985,1439,2 février,Nomination de Jacques Cœur en tant que grand argentier de France
986,1439,25 juin,Les pères conciliaires bâlois déclarent hérétique le pape Eugène IV
987,1439,27 octobre,Mort d'Albert II du Saint-Empire
988,1439,2 novembre,"Charles VII instaure la paiement de ""la taille"""
989,1439,5 novembre,Election de l'antipape Felix V par les schismatiques bâlois
990,1440,février,"Début de la ""Praguerie"
991,1440,2 février,Election de Frédéric III de Habsbourg au titre de roi des Romains
992,1440,22 février,"Naissance de Ladislas V le Posthume, roi de Bohême et de Hongrie"
993,1440,24 juillet,"Signature du traité de Cusset, qui met un terme à la ""Praguerie"
994,1440,19 septembre,Arrestation de Gilles de Rais
995,1440,11 octobre,Création du collège anglais d'Eton
996,1441,24 juin,Assassinat du shogun Yoshinori Ashikaga
997,1441,1 avril,Mort de Blanche de Navarre
998,1441,9 juillet,Mort du peintre Jan van Eyck
999,1441,4 juin,Prise de Pontoise par Charles VII
1000,1441,5 janvier,"Mort de Jean de Luxembourg, comte de Guise"
1001,1442,28 avril,"Naissance d'Edouard IV, roi d'Angleterre"
1002,1442,20 mai,Election de Christophe III du Danemark au titre de roi de Norvège
1003,1442,17 juin,Couronnement de Frédéric III du Saint-Empire à Aix-la-Chapelle
1004,1442,29 août,"Mort de Jean V, duc de Bretagne"
1005,1442,8 juin,Départ de l'armée de Charles VII pour la campagne de Guyenne
1006,1443,11 octobre,Création du parlement de Toulouse par Charles VII
1007,1443,10 octobre,Accession de Constantin XI Paléologue au despotat de Morée
1008,1443,4 août,Création des Hospices de Beaune
1009,1443,22 juillet,Défaite du canton de Zurich dans la bataille de Saint-Jacques sur la Sihl
1010,1443,,Victoire des Croisés sur les Ottomans à  Ni (Serbie)
1011,1444,10 novembre,La défaite des croisés à Varna
1012,1444,10 septembre,Siège de Metz
1013,1444,26 août,Bataille de la Birse
1014,1444,26 avril,Disparition du peintre Robert Campin
1015,1444,juillet,Le sultan Mehmet II prend le pouvoir de l'Empire ottoman
1016,1444,27 mai,Massacre de Greifensee
1017,1445,août,Expédition de la flotte bourguignonne
1018,1445,19 mai,Première bataille d'Olmedo
1019,1445,26 mai,La première armée permanente en France
1020,1445,1 mars,Naissance du peintre italien Sandro Botticelli
1021,1445,,Naissance du peintre italien Pietro Vannucci
1022,1445,7 juillet,Bataille de Souzdal
1023,1446,6 mars,Bataille de Ragaz
1024,1446,15 avril,Disparition de l'architecte italien Brunelleschi
1025,1446,2 août,Deuxième sultanat ottoman de Murad II
1026,1446,5 octobre,Premier concordat entre le Saint-Siège et le peuple allemand
1027,1446,3 décembre,Le sultan Murat II franchit le mur de l'Hexamilion
1028,1447,18 février,Arrestation du duc Humphrey de Lancastre
1029,1447,6 mars,Election du pape Nicolas V
1030,1447,25 juin,Casimir IV Jagellon devient le nouveau roi de Pologne
1031,1447,14 août,Création de la république ambrosienne
1032,1447,23 novembre,Assassinat de Vlad II Dracul et de son fils Mircea
1033,1448,16 mars,Début de la campagne de Normandie
1034,1448,28 avril,Création du corps des francs-archers
1035,1448,20 juin,Charles VIII Knutsson devient roi de Suède
1036,1448,28 septembre,"Election du nouveau roi du Danemark, Christian Ier d'Oldenbourg"
1037,1448,octobre,Vlad III Basarab s'empare du trône de Valachie
1038,1449,6 janvier,Election de l'empereur byzantin Constantin XI Paléologue
1039,1449,23 mars,François de Surienne s'empare de la ville de Fougères
1040,1449,19 juillet,Prise de Verneuil
1041,1449,12 octobre,Bogdan II Musat devient prince de Moldavie
1042,1449,10 novembre,Libération de la ville de Rouen
1043,1450,24 avril,Assassinat de Gilles de Bretagne
1044,1450,,Naissance du peintre Jérôme Bosch
1045,1450,1 janvier,Prise d'Harfleur
1046,1450,2 août,Christian Ier de Danemark devient roi de Norvège
1047,1450,15 avril,Bataille de Formigny
1048,1451,31 juillet,Arrestation de Jacques Cur
1049,1451,12 juin,Signature du traité de capitulation de la ville de Bordeaux
1050,1451,22 avril,"Naissance d'Isabelle, reine de Castille"
1051,1451,18 février,Second sultanat de Mehmed II al Fatih
1052,1452,23 octobre,L'anglais John Talbot reprend la ville de Bordeaux
1053,1452,7 octobre,Bulle Cum Nulla du pape Nicolas V et introduction des carmélites en France
1054,1452,février,Alexandre redevient prince de Moldavie
1055,1452,2 octobre,"Naissance du futur roi d'Angleterre, Richard III"
1056,1453,20 avril,Bataille du Bosphore
1057,1453,novembre,Shin Sawbu arrive au pouvoir en Basse-Birmanie
1058,1453,29 mai,L'empereur byzantin Constantin XI Paléologue est tué au combat
1059,1453,29 mai,Constantinople aux mains des Turcs ottomans
1060,1453,28 octobre,Ladislas Ier de Bohême est couronné roi de Bohême
1061,1453,17 juillet,John Talbot meurt au combat
1062,1453,17 juillet,Fin de la Guerre de Cent Ans
1063,1453,,Gènes confie la gestion de la Corse à lOffice de Saint-Georges
1064,1454,21 juillet,Couronnement d'Henri IV de Castille
1065,1454,octobre,Evasion de Jacques Cur
1066,1454,8 janvier,Nicolas V et la bulle Romanus Pontifex
1067,1454,17 février,Le Vu du faisan de Philippe le Bon
1068,1454,9 avril,Paix de Lodi
1069,1455,1 décembre,Disparition du sculpteur italien Lorenzo Ghiberti
1070,1455,7 novembre,Procès de réhabilitation de Jeanne d'Arc
1071,1455,8 avril,Election du pape Calixte III
1072,1455,23 février,Première impression de la bible de Gutenberg
1073,1455,2 août,Naissance de Jean Ier Cicéron de Brandebourg
1074,1455,22 mai,La guerre des Deux-Roses
1075,1456,4 juillet,Siège de Belgrade
1076,1456,11 août,Disparition de Jean Hunyadi
1077,1456,15 décembre,Un tremblement de terre dévaste Naples
1078,1456,4 décembre,Disparition de Charles Ier de Bourbon
1079,1456,13 octobre,Début de la diète hongroise
1080,1456,22 août,Disparition de Vladislav II de Valachie
1081,1457,,Constantinople devient Istanbul
1082,1457,29 juin,Christian Ier de Danemark devient roi de Suède
1083,1457,12 avril,Etienne III devient hospodar de Moldavie
1084,1457,6 mars,Exécution de Ladislas Hunyadi
1085,1458,,Ferdinand Ier devient roi de Naples
1086,1458,24 janvier,Mathias Ier Corvin devient roi de Hongrie
1087,1458,19 août,Election du pape Pie II
1088,1458,26 décembre,Disparition d'Arthur III de Bretagne
1089,1458,,Début du règne de Jean II
1090,1459,21 juin,Concile de Mantoue
1091,1459,12 novembre,Le pape Pie II fonde l'université de Bâle
1092,1459,12 octobre,Bataille de Ludford Bridge
1093,1459,23 septembre,Bataille de Blore Heath
1094,1459,24 avril,Fra Mauro achève la mappemonde de l'ancien monde
1095,1460,13 novembre,Disparition d'Henri le Navigateur
1096,1460,avril,Dan III Danicul tente de s'emparer de la Valachie
1097,1460,30 décembre,Bataille de Wakefield
1098,1460,3 août,Mort accidentelle de Jacques II d'Ecosse
1099,1460,20 septembre,Mort de Gilles Binchois
1100,1460,10 juillet,Bataille de Northampton
1101,1461,28 juin,Couronnement d'Edouard IV d'Angleterre
1102,1461,15 août,Couronnement de Louis XI
1103,1461,15 août,Prise de Trébizonde
1104,1461,22 juillet,Disparition du roi de France Charles VII
1105,1461,17 février,Seconde bataille de Saint-Albans
1106,1462,11 mars,Début de l'insurrection des Catalans
1107,1462,27 mars,Ivan III devient prince de Moscou
1108,1462,9 mai,Traité de Bayonne
1109,1462,30 juin,Bataille de Seckenheim
1110,1462,27 juin,Naissance de Louis II d'Orléans
1111,1463,,Mehmed II occupe la Bosnie
1112,1463,décembre,Fondation de l'université de Bourges
1113,1463,1 novembre,Exécution de David II Comnène
1114,1463,15 septembre,Bataille de Zatoka Swieza
1115,1463,12 septembre,Traité d'alliance offensive contre les Turcs
1116,1463,5 janvier,François Villon banni de Paris
1117,1465,5 octobre,Paix de Conflans
1118,1472,,Le déclin du Maroc sous les Wattasides
1119,1474,,Antonello da Messina voyage à Venise
1120,1476,21 juin,Charles le téméraire est battu à Morat
1121,1477,18 août,Les Pays-Bas sous les Habsbourg
1122,1477,25 janvier,Naissance d'Anne de Bretagne
1123,1478,,Sixte IV autorise la désignation d'inquisiteurs espagnols
1124,1478,26 avril,La conjuration des Pazzi
1125,1482,11 février,Torquemada inquisiteur
1126,1482,23 décembre,La Bourgogne et la Picardie deviennent françaises
1127,1484,28 mars,Création de la Garde civile en Espagne.
1128,1484,5 décembre,"Innocent VIII lance ""la chasse aux sorcières"""
1129,1485,22 août,Fin de la guerre des Deux-Roses
1130,1486,,Berlin devient la capitale des Hohenzollern
1131,1488,28 juillet,Les Bretons vaincus à Saint Aubin-du-Cormier
1132,1491,6 décembre,Mariage d'Anne de Bretagne
1133,1492,2 janvier,Fin du royaume maure de Grenade
1134,1492,17 avril,Les capitulations de Santa Fé
1135,1492,28 juin,La première ascension officielle
1136,1492,12 octobre,Christophe Colomb découvre l'Amérique
1137,1492,3 août,Christophe Colomb quitte l'Espagne
1138,1492,28 octobre,Colomb découvre Cuba
1139,1493,25 septembre,Colomb part vers le nouveau monde pour la deuxième fois
1140,1494,12 septembre,Naissance de François Ier
1141,1494,7 juin,Le traité de Tordesillas
1142,1494,3 mai,Christophe Colomb débarque en Jamaïque
1143,1494,,Le goût de l'innovation de Léonard de Vinci n'est pas toujours récompensé
1144,1497,24 juin,Jean Cabot découvre le Labrador
1145,1497,8 juillet,Départ de l'expédition de Vasco de Gama
1146,1497,22 novembre,Vasco de Gama atteint le Cap 
1147,1498,20 mai,Vasco de Gama arrive en Inde
1148,1499,8 janvier,Mariage de Louis XII avec Anne de Bretagne
1149,1499,22 septembre,Signature du traité de Bâle
1150,1500,22 avril,Découverte du Brésil
1151,1500,8 mars,L'expédition Cabral part de Lisbonne 
1152,1501,,Les Séfévides règnent sur la Perse
1153,1502,,Découverte de la Martinique par Christophe Colomb
1154,1503,,De Vinci peint La Joconde
1155,1505,27 octobre,Mort d'Ivan III de Russie
1156,1505,25 mars,Départ de l'expédition de Francisco de Almeida vers les Indes
1157,1505,19 juin,"Début du règne de Zhengde, empereur Ming"
1158,1505,15 septembre,Naissance de Marie de Hongrie
1159,1505,27 octobre,Début du règne de Vassili III
1160,1506,25 septembre,Mort de Philippe le Beau
1161,1506,18 avril,Construction de la basilique Saint-Pierre de Rome
1162,1506,20 mai,Mort de Christophe Colomb
1163,1506,19 août,Sigismond Ier succède à son frère Alexandre Ier
1164,1506,19 août,"Mort de Aleksander Jagiello?czyk I, roi de Pologne"
1165,1506,22 janvier,Création de la Garde suisse pontificale
1166,1506,16 mars,"Edmond de la Pole, est capturé en Bourgogne"
1167,1507,,"Naissance d'Anne Boleyn, reine d'Angleterre"
1168,1507,12 mars,"Mort de César Borgia, prince italien de la Renaissance"
1169,1507,3 avril,Martin Luther est ordonné prêtre
1170,1507,25 avril,Waldseemuller produit un planisphère du Nouveau Monde
1171,1507,4 juin,Couronnement de Louis Jagellon du vivant de son père
1172,1508,,Début de la fresque du Plafond de la chapelle Sixtine
1173,1508,10 décembre,Traité de Cambrai
1174,1508,30 novembre,"Naissance d'Andrea di Pietro della Gondola, architecte italien"
1175,1508,avril,Mihnea Ier s'empare du trône de Valachie
1176,1508,3 février,Maximilien d'Autriche prend le titre d'empereur romain élu
1177,1509,21 avril,Mort du roi Henri VII d'Angleterre
1178,1509,3 août,"Naissance d'Étienne Dolet, imprimeur français"
1179,1509,14 mai,Victoire de la ligue de Cambrai à Agnadel
1180,1509,10 juillet,"Naissance de Jean Calvin, réformateur religieux français"
1181,1509,,"Naissance d'Ambroise Paré, chirurgien français"
1182,1509,18 janvier,Bataille du cap Finisterre
1183,1510,25 mars,Naissance de Guillaume Postel
1184,1510,,"Naissance de François Clouet, peintre français"
1185,1510,6 mars,Diète d'Empire à Augsbourg
1186,1510,17 mai,Mort du peintre italien  Botticelli
1187,1510,1 mars,"Mort de Francisco de Almeida, explorateur portugais"
1188,1510,25 novembre,Les Portugais prennent Goa
1189,1511,,Diego Velásquez de Cuellar conquiert Cuba
1190,1511,11 mars,Mort de Charles II d'Amboise de Chaumont
1191,1511,30 juillet,"Naissance de Giorgio Vasari, peintre, architecte et historien italien"
1192,1511,18 octobre,"Mort de Philippe de Commynes, diplomate et historien français"
1193,1511,17 novembre,Traité de Westminster entre Ferdinand II d'Aragon et Henri VIII d'Angleterre
1194,1511,novembre,Antonio de Abreu découvre Timor
1195,1512,3 mai,Ouverture du concile du Latran
1196,1512,24 avril,Selim Ier fait abdiquer son père
1197,1512,31 octobre,Inauguration de la fresque de la Chapelle Sixtine
1198,1512,11 avril,Bataille de Ravenne 
1199,1512,juillet,La Diète d'Empire organise le territoire allemand sur un modèle fédéral
1200,1512,5 mars,"Naissance de Gerardus Mercator, mathématicien et géographe flamand"
1201,1512,,"Copernic rédige son uvre majeure ""Révolution des sphères célestes"""
1202,1513,25 septembre,Découverte de l'Océan Pacifique
1203,1513,2 avril,Découverte de la Floride
1204,1513,7 septembre,Début du siège de Dijon par les Suisses
1205,1513,16 août,"Bataille de Guinegatte, près de Saint-Omer "
1206,1513,1 décembre,Promesse de mariage entre de Charles de Castille et Renée de France
1207,1513,22 juillet,Christian II est élu roi de Danemark et de Norvège
1208,1513,6 juin,Défaite française lors de la bataille de Novare
1209,1514,9 janvier,Mort de la duchesse Anne de Bretagne
1210,1514,18 mai,Mariage de Claude de France et de François de Valois
1211,1514,9 octobre,Mariage du roi Louis XII et de Marie d'Angleterre
1212,1514,31 décembre,"Naissance d'André Vésale, anatomiste belge"
1213,1514,mai,Grande jacquerie conduite par György Dózsa en Hongrie
1214,1515,13 septembre,François 1er victorieux à Marignan
1215,1515,1 janvier,Mort de Louis XII
1216,1515,16 décembre,"Mort d'Afonso de Albuquerque, navigateur portugais"
1217,1515,25 janvier,Sacre de François Ier
1218,1515,8 février,Création du parlement de Rouen
1219,1515,9 octobre,Juan Díaz de Solís découvre le Río de la Plata
1220,1515,23 février,Le droit du sol est accordé à tout enfant né en France de parents étrangers
1221,1516,29 novembre,Paix de Fribourg
1222,1516,29 mars,Création du ghetto de Venise
1223,1516,29 novembre,Signature de la « paix perpétuelle » entre la Suisse et la France
1224,1516,22 mars,Charles Ier prend la couronne de Castille et d'Aragon
1225,1516,13 mars,Début du règne de Louis II Jagellon
1226,1516,,"Léonard de Vinci, un soupçon opportuniste, se place au service du roi de France"
1227,1516,18 février,"Naissance de Marie Tudor, future reine d'Angleterre"
1228,1516,13 août,Milan est cédée par l'Espagne à la France par le traité de Noyon
1229,1517,22 janvier,Bataille de Ridaniya
1230,1517,8 novembre,Mort de Francisco Jiménez de Cisneros
1231,1517,31 octobre,Les 95 thèses de Martin Luther
1232,1517,8 octobre,Fondation de la ville du Havre
1233,1517,26 mars,"Mort de Heinrich Isaac, compositeur flamand"
1234,1517,11 mars,"L'empereur Maximilien, Charles de Habsbourg et François Ier s'allient dans le traité de Cambrai"
1235,1518,2 mai,François Ier autorise le mariage de Laurent II de Médicis et de Madeleine de la Tour d'Auvergne
1236,1518,14 octobre,Signature du Traité de Londres entre la France et l'Angleterre.
1237,1518,7 octobre,Luther affirme la supériorité de l'écriture sur l'autorité du pape.
1238,1518,3 août,Ouverture de la diète d'Augsbourg
1239,1518,mai,Mort du corsaire Arudj Barberousse
1240,1519,12 janvier,Décès de Maximilien Ier du Saint-Empire
1241,1519,28 juin,Charles Quint empereur
1242,1519,13 avril,Naissance de Catherine de Médicis
1243,1519,2 mai,"Léonard De Vinci, qui incarne le génie universel, s'éteint"
1244,1519,15 août,La ville de Panama est fondée par les Espagnols
1245,1519,8 novembre,Les Espagnols entrent dans Mexico
1246,1519,16 février,"Naissance de Gaspard II de Coligny, amiral de France"
1247,1519,27 juin,Dispute de Leipzig
1248,1519,20 septembre,Départ de Magellan vers les Indes
1249,1519,31 mars,Naissance d'Henri II
1250,1520,7 juillet,Victoire de Cortés sur les Aztèques à la bataille d'Otumba
1251,1520,21 août,Incendie de Medina del Campo par l'armée royale de Castille
1252,1520,30 juin,"La ""Noche triste"" à Tenochtitlán"
1253,1520,8 novembre,Le bain de sang de Stockholm
1254,1520,21 octobre,Découverte de Saint Pierre et Miquelon
1255,1520,21 octobre,Magellan traverse son détroit
1256,1520,4 novembre,Christian II est couronné roi de Suède
1257,1520,7 juin,L'entrevue du Camp du Drap d'or
1258,1520,22 septembre,Début du sultanat ottoman de Soliman le Magnifique
1259,1520,23 avril,Pánfilo de Narvaez envoyé contre Hernán Cortés
1260,1520,6 avril,Mort du peintre italien Raphaël
1261,1521,27 mai,Début du règne de Ming Jiajing
1262,1521,3 janvier,Excommunication de Martin Luther
1263,1521,27 avril,Magellan meurt aux Philippines
1264,1521,13 août,Cortès s'empare de Tenochtitlán
1265,1521,19 mai,Siège de Pampelune
1266,1521,26 mai,Luther mis au ban de l'Empire
1267,1521,31 août,Siège de Mézières
1268,1521,23 avril,Bataille de Villalar
1269,1521,13 décembre,Décès du roi de Portugal Manuel Ier
1270,1521,16 mars,Magellan découvre les Philippines
1271,1522,7 février,Traité de Bruxelles
1272,1522,19 juin,Traité de Windsor
1273,1522,,Naissance du poète français Joachim du Bellay
1274,1522,6 septembre,L'expédition Magellan boucle son premier tour du Monde
1275,1522,15 octobre,Hernan Cortes est nommé gouverneur général de la Nouvelle-Espagne
1276,1522,20 décembre,Soliman le magnifique s'empare de Rhodes
1277,1522,11 septembre,Naissance du scientifique italien Ulisse Aldrovandi
1278,1523,,Mort du peintre italien Pietro Vannucci
1279,1523,1 juillet,"Henri Voes et Jean Van Hessen, deux luthériens, sont brûlés vifs à Bruxelles"
1280,1523,18 mars,Création du Trésor de l'Epargne
1281,1523,16 octobre,Mort du peintre italien Luca Signorelli
1282,1523,6 juin,Gustave Ier Vasa roi d'une Suède indépendante
1283,1523,20 janvier,Début du règne de Frédéric Ier de Danemark
1284,1524,24 août,Début de la guerre des paysans allemands
1285,1524,20 juillet,Décès de Claude de France
1286,1524,26 octobre,François Ier prend Milan
1287,1524,29 avril,Bataille de la Sesia
1288,1524,avril,Giovanni da Verrazano découvre la baie de New York
1289,1524,24 décembre,Décès de Vasco de Gama
1290,1524,11 septembre,Naissance de Pierre de Ronsard
1291,1525,28 février,Mort de Cuauhtémoc
1292,1525,5 avril,Albert de Brandebourg se convertit à la Réforme de Martin Luther
1293,1525,15 mai,Bataille de Frankenhausen
1294,1525,27 mai,Décès de Thomas Muntzer
1295,1525,24 février,François Ier est fait prisonnier à Pavie
1296,1525,4 août,Décès du sculpteur italien Andrea della Robbia
1297,1525,24 février,Mort de l'amiral français Guillaume Gouffier de Bonnivet
1298,1526,29 août,Soliman le Magnifique bat les Hongrois
1299,1526,,Décès du peintre italien Vittore Carpaccio
1300,1526,14 janvier,François Ier signe le traité de Madrid
1301,1526,21 janvier,Mariage de Vassili III et d'Héléna Glinska
1302,1526,17 mars,Libération de François Ier
1303,1526,21 avril,Bataille de Panipat
1304,1526,23 octobre,Ferdinand de Habsbourg devient roi de Bohême
1305,1526,,Décès du navigateur portugais Pedro Alvares Cabral
1306,1526,22 mai,Ligue de Cognac
1307,1527,24 juin,Recès de Vasteras
1308,1527,6 mai,Le sac de Rome
1309,1527,13 juillet,Naissance du mathématicien britannique John Dee
1310,1527,,Mort de lempereur Huayna Cápac
1311,1527,21 juin,Décès du penseur italien Nicolas Machiavel
1312,1527,16 mai,Renversement des Médicis à Florence
1313,1527,20 janvier,Petru Rares devient prince de Moldavie
1314,1528,6 avril,Décès du peintre et graveur allemand Albrecht Dürer
1315,1528,,Décès du peintre italien Paul Véronèse
1316,1528,,Disparition de l'explorateur Giovanni da Verrazzano
1317,1528,,Francisco Pizarro est enfermé à Séville
1318,1528,15 août,Décès de Lautrec
1319,1529,avril,Publication du Petit Catéchisme de Martin Luther
1320,1529,22 avril,Traité de Saragosse
1321,1529,1 juin,Le roi Henri VIII demande le divorce
1322,1529,21 juin,Bataille de Landriano
1323,1529,3 août,Signature de la paix de Cambrai
1324,1529,4 octobre,Colloque de Marbourg
1325,1530,25 août,Naissance d'Ivan IV de Russie
1326,1530,,Fondation du Collège de France
1327,1530,27 décembre,Francisco Pizarro prépare son expédition vers le Pérou
1328,1530,25 juin,Confession d'Augsbourg
1329,1530,23 février,Charles Quint est couronné par le Pape
1330,1530,26 décembre,"Décès de Bâbur, fondateur de l'Empire Moghol"
1331,1531,5 janvier,Ferdinand de Habsourg roi des Romains
1332,1531,26 janvier,Un séisme frappe Lisbonne
1333,1531,11 février,Création de l'Eglise Anglicane
1334,1531,21 janvier,Décès du peintre florentin Andrea del Sorto
1335,1531,11 octobre,Mort du réformiste Ulrich Zwingli
1336,1531,24 novembre,Décès de l'humaniste allemand colampade
1337,1531,27 février,Formation de la Ligue de Smalkalde
1338,1532,13 août,Edit d'union de la Bretagne à la France
1339,1532,16 novembre,Pizarro capture le dernier empereur Inca
1340,1532,27 juillet,Promulgation de la Lex Carolina
1341,1532,,Naissance du compositeur Roland de Lassus
1342,1532,15 juin,Naissance de l'écrivain flamand Frans de Costere
1343,1532,,"Rabelais édite ""Gargantua"""
1344,1532,23 juillet,Signature de la Paix de Nuremberg
1345,1533,25 janvier,Mariage d'Henri VIII d'Angleterre et Anne Boleyn
1346,1533,28 février,Naissance de Michel de Montaigne
1347,1533,29 août,Mise à mort d'Atahualpa
1348,1533,10 avril,Mort de Frédéric 1er de Danemark
1349,1533,7 septembre,Naissance d'Elizabeth 1ere
1350,1533,28 octobre,Mariage du Duc d'Orléans et de Catherine de Médicis
1351,1533,28 octobre,Mariage d'Henri d'Orléans et Cathérine de Médicis
1352,1533,15 novembre,Prise de Cuzco par les Espagnols
1353,1533,4 décembre,Début du règne d'Ivan IV le Terrible
1354,1533,7 septembre,Naissance d'Elisabeth 1re d'Angleterre
1355,1534,4 juillet,Début du règne de Christian III de Danemark
1356,1534,,Les Turcs prennent Tunis
1357,1534,,"Le Parmesan commence ""la Vierge au long cou"""
1358,1534,5 mars,Décès du peintre italien Le Corrège
1359,1534,24 juillet,Jacque Cartier prend possession du Canada
1360,1534,5 septembre,Jacques Cartier ramène deux Indiens de sa première expédition au Canada
1361,1534,9 août,Décès du cardinal dominicain Cajetan
1362,1534,15 août,Fondation de l'ordre des Jésuites
1363,1534,15 août,Premier vu de la Compagnie de Jésus
1364,1534,13 octobre,Elèction du Pape Paul III
1365,1534,18 octobre,"L'Affaire des ""placards"""
1366,1534,9 août,Jacques Cartier découvre le Saint-Laurent
1367,1535,,"L'Inquisition met en place les certificats de ""propreté du sang"""
1368,1535,17 avril,Fondation de la vice-royauté en Nouvelle Espagne
1369,1535,18 janvier,Fondation de Lima
1370,1535,13 janvier,François Ier censure les livres
1371,1535,,Bataille de Tunis
1372,1535,3 mai,L'expédition de Hernan Cortès atteint La Paz
1373,1535,6 juillet,Décapitation de Sir Thomas More
1374,1535,2 octobre,Jacques Cartier découvre Montréal
1375,1535,4 juin,Edition de la Bible d'Olivetan
1376,1536,19 mai,Henri VIII fait décapiter son épouse
1377,1536,6 octobre,William Tyndale brûlé comme hérétique
1378,1536,11 février,Philippe Chabot occupe la Bresse et la Savoie
1379,1536,4 février,Le Pays de Galles est rattaché à l'Angleterre
1380,1536,4 février,François Ier s'allie avec Soliman le Magnifique
1381,1536,3 février,Pedro de Mendoza fonde la ville de Buenos Aires
1382,1537,28 décembre,Edit de Montpellier
1383,1537,12 octobre,"Naissance d'Edouard VI, futur roi d'Angleterre"
1384,1537,août,La bataille de Montemurlo
1385,1537,2 juin,Publication de la lettre Véritas Ispa de Paul III
1386,1537,6 janvier,Assassinat d'Alexandre de Médicis
1387,1538,18 juin,Paix entre François 1er et Charles Quint
1388,1538,24 avril,Citation à comparaitre sur le tombeau de Thomas Becket
1389,1538,18 mars,Décès de l'évêque Erard de La Marck
1390,1538,8 juillet,Hernando Pizarro met à mort Diego de Almagro
1391,1538,28 septembre,Victoire Ottomane à la bataille de Prévéza
1392,1539,22 septembre,Guru Nanak fonde la religion des Sikhs
1393,1539,28 juin,Henri VIII promulgue le Statut des six articles
1394,1539,1 mai,Mort d'Isabelle de Portugal
1395,1539,avril,Pédro de Valdivia entreprend la conquête du Chili
1396,1539,10 août,Signature de l'ordonnance de Villers-Cotterêts
1397,1539,29 janvier,Décès du peintre italien Le Pordenone
1398,1540,,Création de la première bourse française
1399,1540,,Répression de la révolte des gantois
1400,1540,,Naissance du mathématicien François Viete
1401,1540,22 avril,Francisco Vásquez de Coronado quitte Culiacan
1402,1540,28 juillet,Exécution de Thomas Cromwell
1403,1540,1 juin,Edit de Fontainebleau
1404,1541,7 novembre,Violente introduction de la Réforme en Islande
1405,1541,25 décembre,Inauguration de la fresque du Jugement dernier de la chapelle Sixtine
1406,1541,26 juin,Pizarro assassiné
1407,1541,12 février,Fondation de Santiago du Chili
1408,1541,,"Henri VIII, roi dIrlande"
1409,1542,12 février,Exécution de la cinquième femme d'Henri VIII
1410,1542,26 août,Francisco de Orellana parvient à lembouchure de lAmazone
