,date,date_day,h2
3570,1799,18 juin,Coup d'État du 30 prairial
3571,1799,16 avril,La bataille de Mont-Thabor
3572,1799,juin,Souvorov bat les Français à la Bataille de Trébia
3573,1800,24 décembre,Attentat manqué contre Napoléon 
3574,1800,14 juin,La bataille de Marengo
3575,1800,1 octobre,La Louisiane devient française
3576,1800,24 avril,La fondation de la Bibliothèque du Congrès
3577,1800,18 janvier,Création de la Banque de France
3578,1801,16 juillet,Signature du Concordat
3579,1801,31 août,Fin de l'expédition d'Egypte
3580,1801,7 novembre,Volta présente sa pile électrique à Bonaparte 
3581,1801,3 mars,Naissance de la bourse londonienne
3582,1801,6 juillet,Elgin autorisé par l'Empire Ottoman a prélever des frises sur le Parthénon
3583,1801,,La Bourse de Paris est officialisée
3584,1801,,"Le parlement britannique promulgue le ""General Enclosure Act"""
3585,1801,1 janvier,Mise en vigueur de lActe dunion en Irlande
3586,1801,9 février,Paix de Lunéville
3587,1802,11 septembre,Annexion du Piémont par la France
3588,1802,11 octobre,Naissance officielle du parachute
3589,1802,2 août,Napoléon devient consul à vie
3590,1802,19 mai,Création de la Légion d'honneur
3591,1802,25 mars,Paix d'Amiens
3592,1803,24 novembre,Inauguration du pont des Arts
3593,1803,28 mars,Création du Franc Germinal
3594,1803,30 avril,Bonaparte cède la Louisiane
3595,1803,12 avril,Apparition du livret ouvrier
3596,1803,19 février,Napoléon Bonaparte met en place lActe de médiation en Suisse
3597,1803,18 novembre,Les troupes françaises sont défaites à saint-Domingue
3598,1804,2 décembre,Bonaparte devient empereur des Français
3599,1804,25 juin,Fin de la chouannerie
3600,1804,18 mai,Sacre de Napoléon
3601,1804,1 janvier,Indépendance d'Haïti
3602,1804,21 février,Premier essai d'une locomotive à vapeur
3603,1804,21 mars,Publication du Code Civil
3604,1804,14 mai,Le départ de l'expédition Lewis et Clark
3605,1804,21 mars,Assassinat du Duc d'Enghien
3606,1805,2 décembre,Victoire d'Austerlitz
3607,1805,15 octobre,Bataille d'Ulm
3608,1805,7 avril,Première de la symphonie héroïque
3609,1805,30 décembre,Napoléon  change de nom
3610,1805,20 novembre,Première de Fidelio
3611,1805,20 octobre,La reddition d'Ulm
3612,1805,21 octobre,Bataille navale de Trafalgar
3613,1805,14 novembre,Napoléon entre dans Vienne
3614,1805,26 décembre,Signature de la paix de Presbourg
3615,1806,14 octobre,Victoire de Iéna
3616,1806,6 août,Fin du Saint Empire romain germanique
3617,1806,5 juin,La République batave devient le Royaume de Hollande
3618,1806,10 mai,Napoléon crée luniversité impériale
3619,1806,18 mars,Création du conseil de prud'hommes
3620,1806,26 février,Construction de l'Arc de Triomphe
3621,1806,21 novembre,Napoléon établit le blocus continental
3622,1807,17 décembre,Le décret de Milan renforce le blocus
3623,1807,30 novembre,Lisbonne capitule face à Napoléon
3624,1807,18 août,"Le ""Clermont"" effectue son premier trajet"
3625,1807,17 septembre,Création de la cour des comptes
3626,1807,31 janvier,François Isaac de Rivaz dépose le brevet du moteur à explosion
3627,1807,8 février,Bataille d'Eylau
3628,1807,2 mars,L'Angleterre interdit la traite des noirs
3629,1807,16 août,Le gaz éclaire Londres
3630,1807,7 juillet,Traité de Tilsit
3631,1807,,"Publication de la ""Phénoménologie de l'esprit"""
3632,1808,2 mai,Madrid se révolte contre les Français
3633,1808,22 juillet,Les Français chassés d'Espagne
3634,1808,4 décembre,Reddition de Madrid
3635,1809,22 avril,La bataille d'Eckmühl
3636,1809,17 mai,Les États pontificaux annexés à lEmpire
3637,1809,14 octobre,Le traité de Schönbrunn donne naissance aux Provinces Illyriennes
3638,1809,15 décembre,Napoléon divorce d'avec Joséphine
3639,1809,6 juillet,Bataille de Wagram
3640,1810,3 décembre,Les Anglais prennent les îles françaises
3641,1810,1 avril,Napoléon Ier épouse Marie-Louise d'Autriche
3642,1811,20 février,Chateaubriand à l'Académie
3643,1811,20 mars,Naissance de l'héritier de Napoléon
3644,1811,1 mai,Méhémet Ali massacre 470 chefs mamelouks
3645,1811,19 septembre,Les sapeurs-pompiers deviennent militaires
3646,1811,5 juillet,Indépendance du Vénézuela
3647,1812,,Invention de la presse cylindrique
3648,1812,14 septembre,Napoléon entre dans Moscou
3649,1812,7 septembre,Bataille de la Moskova
3650,1812,22 août,Découverte de Pétra
3651,1812,24 juin,Le début de la campagne de Russie
3652,1812,18 juin,Guerre entre les Etats-Unis et la Grande-Bretagne
3653,1812,23 octobre,Le général Mallet rate son Coup d'Etat
3654,1812,26 novembre,Désastre de la Bérézina
3655,1813,19 octobre,Fin de la bataille des Nations
3656,1813,1 décembre,Guillaume Ier monte sur le trône hollandais
3657,1813,8 octobre,Les Anglais s'emparent de l'Aquitaine
3658,1814,1 novembre,Début du congrès de Vienne
3659,1814,11 janvier,Murat trahit Napoléon
3660,1814,15 octobre,L'île Maurice devient anglaise
3661,1814,14 janvier,Le Danemark cède la Norvège à la Suède
3662,1814,6 avril,Napoléon Ier abdique
3663,1814,,"Ingres peint sa ""Grande Odalisque"""
3664,1814,23 octobre,Première chirurgie esthétique
3665,1814,4 mai,Napoléon 1er débarque sur l'île d'Elbe
3666,1814,4 juin,Louis XVIII établit a Charte constitutionnelle
3667,1814,17 mai,Une Constitution pour la Norvège
3668,1815,1 mars,Napoléon regagne la France
3669,1815,19 mars,Louis XVIII fuit la France
3670,1815,5 mars,Arrivée triomphante de Napoléon à Grenoble
3671,1815,27 septembre,Création de la Sainte Alliance
3672,1815,10 avril,Le mont Tambora explose
3673,1815,20 novembre,Signature du second traité de Paris
3674,1815,22 avril,Napoléon promulgue lActe additionnel aux Constitutions de lEmpire
3675,1815,13 octobre,Murat fusillé
3676,1815,15 octobre,Napoléon débarque à Sainte-Hélène
3677,1815,20 juin,« Le coup de Bourse » de Nathan Rothschild
3678,1815,2 août,"Le maréchal Brune victime de la ""Terreur blanche"""
3679,1815,7 août,Signature du « Pacte fédéral » en Suisse
3680,1815,7 décembre,Exécution du maréchal Ney
3681,1815,9 juin,Fin du Congrès de Vienne
3682,1815,18 juin,"""Waterloo, morne plaine..."""
3683,1815,26 septembre,Le duc de Richelieu devient Premier Ministre
3684,1815,21 août,"Election de la ""Chambre introuvable"""
3685,1816,4 octobre,Une chambre des députés plus modérée
3686,1816,8 septembre,"Dissolution de la ""Chambre introuvable"""
3687,1816,9 juillet,Indépendance de l'Argentine 
3688,1816,2 juillet,"Naufrage de ""La Méduse"""
3689,1816,20 février,Rossini crée le Barbier de Séville
3690,1817,février,Loi sur le suffrage censitaire
3691,1817,,Les Séminoles entrent en guerre contre les Américains
3692,1818,,La créature de Frankenstein vient au monde
3693,1818,12 mars,Loi Gouvion-Saint Cyr sur la conscription
3694,1818,21 novembre,Le congrès d'Aix-la-Chappelle met fin à l'occupation militaire de la France
3695,1818,25 décembre,Douce nuit chanté pour la première fois
3696,1818,,Schubert compose la Truite
3697,1819,juin,Assouplissement de la liberté de la presse
3698,1819,17 décembre,Bolivar fonde la Colombie
3699,1823,8 janvier,Naissance d'Alfred Russel Wallace.
3700,1823,5 avril,Bataille d'Ochomogo.
3701,1823,26 janvier,Décès d'Edward Jenner.
3702,1823,16 février,Décès de Pierre-Paul Prud'hon.
3703,1823,28 février,Naissance d'Ernest Renan.
3704,1823,14 mars,Décès de Charles François Dumouriez.
3705,1823,7 avril,Expédition d'Espagne.
3706,1823,11 septembre,Décès de David Ricardo.
3707,1823,14 mars,Naissance de Théodore de Banville.
3708,1823,11 décembre,Les Ottomans lèvent le deuxième siège de Missolonghi.
3709,1823,2 décembre,Le président Monroe expose sa doctrine
3710,1823,22 avril,Invention du roller 
3711,1823,1 juin,Décès de Louis Nicolas Davout
3712,1823,juillet,Traité d'Erzurum.
3713,1823,novembre,Invention du rugby
3714,1823,31 août,Bataille du Trocadéro.
3715,1823,8 septembre,Traité de Moultrie Creek.
3716,1824,14 décembre,"Pierre Puvis de Chavannes, peintre français."
3717,1824,9 décembre,Bataille d'Ayacucho
3718,1824,16 septembre,Mort de Louis XVIII
3719,1824,4 septembre,"Naissance d'Anton Bruckner, compositeur"
3720,1824,20 juillet,"Décès de Maine de Biran, philosophe français (° 1766)."
3721,1824,12 juillet,"Naissance d'Eugène Boudin, peintre français"
3722,1824,janvier,Début de la première guerre britannico-birmane à cause d'un différend sur la frontière indienne
3723,1824,,"Naissance de Yan' Dargent, peintre breton"
3724,1824,14 juin,"Décès de Charles-François Lebrun, troisième consul et prince-architrésorier du Premier Empire"
3725,1824,11 mai,"Naissance Jean-Léon Gérôme, peintre et sculpteur français"
3726,1824,7 mai,Beethoven joue la 9ème symphonie
3727,1824,19 avril,Lord Byron meurt en Grèce
3728,1824,17 mars,"Traité de Londres, qui met fin au conflit hollando-britannique dans l'espace malais et sépare en deux le détroit de Malacca"
3729,1824,6 mars,"Election de la ""Chambre retrouvée"""
3730,1824,26 janvier,"Décès Théodore Géricault, peintre français"
3731,1824,,Le théâtre Maly et le théâtre Bolchoï à Moscou sont achevés
3732,1824,,Le Vu de Louis XIII consacre Ingres au Salon de 1824
3733,1824,3 juillet,Massacre perpétré par les Ottomans contre la population grecque de l'île de Psara
3734,1824,19 février,"Naissance de Henri Germain, banquier français, à l'origine de la fondation du Crédit Lyonnais"
3735,1824,2 juillet,Révolte à Recife qui mène à la déclaration d'indépendance de Pernambuco
3736,1825,23 mars,Loi du milliard des émigrés
3737,1825,28 septembre,Premier transport de passagers en train
3738,1825,25 octobre,"Naissance de Johann Strauss fils, compositeur"
3739,1825,6 novembre,"Naissance de Charles Garnier, architecte français"
3740,1825,30 novembre,Obsèques du général Foy
3741,1825,14 décembre,"Révolte des Décembristes, groupe de jeunes officiers et aristocrates russeS"
3742,1825,13 octobre,"Naissance de Charles Frederick Worth, père de la Haute couture, à Bourne, Angleterre"
3743,1825,29 août,Le Portugal reconnaît l'indépendance du Brésil au traité de Rio de Janeiro
3744,1825,6 août,La Bolivie naît de la scission du Pérou
3745,1825,29 mai,Charles X couronné à Reims
3746,1825,,La Perse envahit la Transcaucasie
3747,1825,,Début de la guerre de Java en Indonésie
3748,1825,4 janvier,Décès de Ferdinand Ier des Deux-Siciles
3749,1825,17 octobre,Victoire uruguayenne sur le Brésil à la Bataille de Sarandí
3750,1825,7 mai,"Décès d'Antonio Salieri, compositeur italien"
3751,1825,29 décembre,"Décès de Jacques-Louis David, peintre néoclassique français"
3752,1825,15 avril,Troisième siège de Missolonghi
3753,1825,9 février,Début de la présidence de coalition de John Quincy Adams aux États-Unis
3754,1825,20 avril,Loi du sacrilège
3755,1825,4 janvier,Début du règne de François Ier des Deux-Siciles
3756,1827,18 décembre,"Naissance de Constantin Pobiedonostsev, homme politique russe"
3757,1827,26 novembre,"Naissance d'Ellen White, créatrice de l'Église adventiste du septième jour"
3758,1827,24 novembre,Retour des libéraux à la chambre des députés
3759,1827,20 octobre,La bataille de Navarin
3760,1827,4 août,"Mort de Claude-Pierre Dellay d'Agier, écrivain et homme politique français"
3761,1827,8 juillet,"Mort de Robert Surcouf, corsaire français"
3762,1827,6 juillet,Signature du traité de Londres
3763,1827,24 juin,"Rejet de la loi ""Justice et amour"""
3764,1827,5 juin,Prise d'Athènes par les Ottomans après un siège de neuf mois
3765,1827,11 mai,"Naissance de Jean-Baptiste Carpeaux, sculpteur, peintre et dessinateur français"
3766,1827,10 mai,"Naissance d'Alphonse de Rothschild, banquier français"
3767,1827,26 mars,"Mort de Ludwig van Beethoven, compositeur allemand"
3768,1827,16 mars,Publication du Freedom's Journal
3769,1827,5 mars,"Mort d'Alessandro Volta, physicien italien"
3770,1827,20 février,Bataille d'Ituzaingó
3771,1827,28 janvier,"Naissance d'Alfred Grévin, sculpteur, caricaturiste, dessinateur et créateur de costumes de théâtre français"
3772,1827,janvier,"Couronnement de Pomare IV, reine de Tahiti, Moorea et dépendances"
3773,1827,29 avril,Villéle conspué par la Garde Nationale
3774,1827,5 mars,"Mort de Pierre-Simon de Laplace, mathématicien, astronome et physicien français"
3775,1828,26 avril,Début de la neuvième guerre russo-turque
3776,1828,8 mai,"Naissance d'Henri Dunant, fondateur de la Croix-Rouge"
3777,1828,20 avril,"René Caillié, explorateur français, atteint Tombouctou"
3778,1828,19 novembre,"Mort de Franz Schubert, compositeur autrichien"
3779,1828,22 septembre,"Mort de Shaka, roi des Zoulous"
3780,1828,29 août,Début de l'expédition de Morée
3781,1828,27 août,Signature du traité de Rio de Janeiro
3782,1828,31 juillet,Champollion s'embarque pour l'Egypte
3783,1828,20 avril,René Caillié entre à Tombouctou 
3784,1828,4 janvier,Martignac remplace Villèle
3785,1828,16 avril,"Mort de Francisco de Goya, peintre et graveur espagnol"
3786,1828,27 juillet,"Mort de Radama Ier, roi de Madagascar"
3787,1828,15 juillet,"Mort de Jean-Antoine Houdon, sculpteur français"
3788,1828,28 juin,"Début du règne de Miguel Ier, roi du Portugal"
3789,1828,,Election présidentielle des Etats-Unis d'Amérique
3790,1828,21 février,Signature du traité de Turkmanchai
3791,1828,10 février,Bataille de Mariel
3792,1828,,Début de la guerre civile du Portugal
3793,1828,29 janvier,Première de la Jeune fille et la mort
3794,1828,8 février,"Naissance de Jules Verne, écrivain français"
3795,1829,10 avril,"Naissance de William Booth, fondateur de l'Armée du salut"
3796,1829,6 avril,"Mort de Niels Henrik Abel, mathématicien norvégien"
3797,1829,31 mars,Début du pontificat de Pie VIII
3798,1829,22 mars,La conférence de Londres rend la Grèce autonome vis-à-vis de l'Empire ottoman
3799,1829,,Quinet participe à lexpédition en Morée
3800,1829,,Le système Braille est mis au point
3801,1829,avril,Lémancipation catholique
3802,1829,29 janvier,"Mort de Paul Barras, homme politique français"
3803,1829,1 août,Premier tirage de « la Revue des Deux Mondes »
3804,1829,8 juin,"Naissance de John Everett Millais, peintre et illustrateur britannique"
3805,1829,16 juin,"Naissance de Géronimo, guerrier apache"
3806,1829,16 février,"Mort de François-Joseph Gossec, compositeur français"
3807,1829,8 août,Martignac remplacé par Polignac
3808,1829,8 août,Bataille de Vila da Praia
3809,1829,14 septembre,Signature du traité d'Andrinople
3810,1829,8 décembre,Début de la dictature de Juan Manuel de Rosas en Argentine
3811,1829,18 décembre,"Mort de Jean-Baptiste de Lamarck, naturaliste français"
3812,1829,,Création de la Principauté de Serbie
3813,1829,juin,Fondation de la ville de Perth en Australie
3814,1829,4 mars,Début de la présidence d'Andrew Jackson aux États-Unis
3815,1833,6 février,"Mort de Pierre André Latreille, entomologiste français"
3816,1833,6 mars,"Naissance d'Henri Rieunier, amiral et homme politique français"
3817,1833,,Alfred de Musset et George Sand entament une liaison tumultueuse
3818,1833,6 janvier,Proclamation de la persécution générale contre les chrétiens par l'empereur Nguy?n Minh M?ng du Vietnam
3819,1833,23 février,Création du Grand Orient de Belgique
3820,1833,5 mai,"Naissance de Ferdinand von Richthofen, géographe et géologue allemand"
3821,1833,7 mai,"Naissance de Johannes Brahms, compositeur, pianiste et chef d'orchestre allemand"
3822,1833,11 novembre,Fondation du Jockey-Club
3823,1833,5 juillet,"Mort de Nicéphore Niépce, inventeur français de la photographie"
3824,1833,6 juillet,"Mort de Pierre-Narcisse Guérin, peintre français"
3825,1833,8 juillet,Signature du traité d'Unkiar-Skelessi
3826,1833,28 juillet,La loi Guizot développe lenseignement primaire
3827,1833,août,Abolition de l'esclavage dans l'empire britannique
3828,1833,29 septembre,Début de la crise de succession d'Espagne
3829,1833,21 octobre,"Naissance d'Alfred Nobel, chimiste, industriel et fabricant d'armes suédois"
3830,1833,5 juillet,Bataille du cap Saint-Vincent
3831,1834,23 octobre,"Mort de Fath Ali Shah Qajar, shah de Perse"
3832,1834,16 octobre,Incendie du palais de Westminster
3833,1834,8 octobre,"Mort de François-Adrien Boieldieu, compositeur français"
3834,1834,1 janvier,"Naissance de Ludovic Halévy, auteur français"
3835,1834,,Les premiers « Contes » dAndersen
3836,1834,27 novembre,Invention du moteur électrique
3837,1834,24 septembre,"Mort de Pierre Ier, empereur du Brésil"
3838,1834,décembre,"Mort de Ang Chan II, roi du Cambodge"
3839,1834,9 avril,Semaine sanglante à Lyon
3840,1834,19 juillet,"Naissance d'Edgar Degas, peintre et sculpteur français"
3841,1834,10 juillet,"Naissance de James Whistler, peintre américain"
3842,1834,20 mai,"Mort du marquis de La Fayette, militaire et homme politique français"
3843,1834,24 avril,Etablissement de la quadruple alliance
3844,1834,14 avril,Massacre de la rue Transnonain
3845,1834,8 mars,Fondation de la Société Saint-Jean-Baptiste de Montréal
3846,1834,8 février,"Naissance de Dmitri Mendeleïev, chimiste russe"
3847,1834,23 décembre,"Mort de Thomas Malthus, économiste britannique"
3848,1834,,Abolition définitive de l'Inquisition espagnole
3849,1834,31 août,"Mort de Karl Ludwig Harding, astronome allemand"
3850,1834,2 août,"Naissance de Frédéric Auguste Bartholdi, sculpteur français"
3851,1835,,Début du Grand Trek des Boers en Afrique du Sud
3852,1835,9 octobre,"Naissance de Camille Saint-Saëns, compositeur français"
3853,1835,2 octobre,Bataille de Gonzales
3854,1835,19 septembre,Début de de la Révolution Farroupilha
3855,1835,15 juillet,Bataille de Mendigorría
3856,1835,28 juin,Bataille de la Macta
3857,1835,25 juin,"Suicide d'Antoine-Jean Gros, peintre français"
3858,1835,9 avril,"Naissance de Léopold II, deuxième roi de Belgique"
3859,1835,8 avril,"Mort de Wilhelm von Humboldt, philosophe, linguiste et diplomate allemand"
3860,1835,2 mars,Début du règne de Ferdinand Ier d'Autriche
3861,1835,2 mars,"Mort de François Ier, Empereur d'Autriche"
3862,1835,7 janvier,"Mort d'Elisa Mercoeur, poétesse française"
3863,1835,,Début de la seconde guerre Séminole
3864,1835,,"Vigny signe sa pièce ""Chatterton"""
3865,1835,,Réforme de l'orthographe française de 1835
3866,1835,22 octobre,Création de l'AFP
3867,1835,30 novembre,"Naissance de Mark Twain, écrivain américain"
3868,1837,29 janvier,Décès de Alexandre Pouchkine.
3869,1837,,Rébellions de 1837.
3870,1837,20 juin,Décès de Guillaume IV du Royaume-Uni.
3871,1837,30 mai,Traité de Tafna.
3872,1837,18 mars,Naissance Grover Cleveland.
3873,1837,11 janvier,Décès de François Gérard.
3874,1837,4 mars,Martin Van Buren est élu président des Etats-Unis.
3875,1837,20 juin,Début du règne de la reine Victoria du Royaume-Uni.
3876,1837,14 décembre,Bataille de Saint-Eustache.
3877,1837,23 novembre,Bataille de Saint-Denis.
3878,1837,13 octobre,Siège de Constantine.
3879,1837,10 octobre,Décès de Charles Fourier.
3880,1837,10 octobre,Ahmed Ier Bey devient Bey de Tunis.
3881,1837,25 novembre,Bataille de Saint-Charles.
3882,1837,,Début de létude de Sainte-Beuve sur Port Royal
3883,1837,28 septembre,Bahadur Shah II monte sur le trône.
3884,1837,26 août,Les débuts du chemin de fer français
3885,1838,26 décembre,"Stendhal termine ""La Chartreuse de Parme"""
3886,1838,30 décembre,Naissance d'Émile Loubet.
3887,1838,5 septembre,Décès de Charles Percier.
3888,1838,,Flora Tristan est touchée au poumon
3889,1838,12 janvier,Combat d'Islay.
3890,1838,18 février,Naissance de Ernst Mach.
3891,1838,26 mars,Décès de Jean-Baptiste Grenier.
3892,1838,17 mai,Décès de Charles-Maurice de Talleyrand-Périgord.
3893,1838,17 mai,Décès de René Caillié.
3894,1838,28 juin,Naissance de Jan Matejko.
3895,1838,1 septembre,Décès de William Clark.
3896,1838,,Construction du grand palais du Kremlin.
3897,1838,24 octobre,Oribe est renversé.
3898,1838,octobre,Les cherokees sur la Piste des larmes
3899,1838,4 novembre,"Stendhal commence ""La Chartreuse de Parme"""
3900,1838,25 octobre,Naissance de Georges Bizet.
3901,1838,7 novembre,Bataille de Lacolle
3902,1838,12 novembre,Première de Ruy Blas
3903,1838,27 novembre,Bataille de San Juan de Ulúa.
3904,1838,16 décembre,Les Boers battent les Zoulous 
3905,1839,août,La première guerre de l'opium éclate
3906,1839,31 décembre,Mort de Hyacinthe-Louis de Quélen
3907,1839,13 décembre,Christian VIII monte sur le trône de Danemark
3908,1839,17 novembre,Le premier opéra de Verdi
3909,1839,30 octobre,Naissance d'Alfred Sisley
3910,1839,25 octobre,"Mort d'Aimé Casimir Marie Picquet, chevalier du Boisguy"
3911,1839,1 juillet,Abdülmecit Ier devient sultan de l'Empire ottoman
3912,1839,13 juin,"Abdication de Milo Obrenovi?, prince de Serbie"
3913,1839,15 février,Création de la République du Natal
3914,1839,19 août,Presentation du daguerréotype
3915,1839,,Naissance des guides de voyage Baedeker
3916,1839,28 août,Décès de William Smith
3917,1839,12 janvier,Combat naval de Casma
3918,1839,février,Chopin et Sand rentrent de Majorque
3919,1839,11 avril,Mort de Charles-Louis Huguet de Sémonville
3920,1841,7 janvier,Victor Hugo entre à l'Académie française
3921,1841,,Edward Eyre traverse le sud de l'Australie
3922,1841,avril,Fondation de la Brook Farm
3923,1841,1 juin,Décès de Nicolas Appert
3924,1841,25 avril,Mayotte devient française
3925,1841,30 janvier,Naissance de Félix Faure
3926,1841,10 février,L'Acte d'Union du Canada est proclamé
3927,1841,25 février,Naissance de Claude Renoir
3928,1841,22 mars,Loi sur le travail des enfants
3929,1841,2 avril,Naissance de Clément Ader
3930,1841,5 juillet,Cook crée la première agence de voyage
3931,1841,15 juillet,Mikhaïl Iourievitch Lermontov meurt lors d'un duel
3932,1841,28 août,Naissance de Louis Le Prince
3933,1841,8 septembre,Naissance d'Antonín Leopold Dvo?ák
3934,1841,2 novembre,Les Britanniques chassés de Kaboul
3935,1841,6 novembre,Naissance d'Armand Fallières
3936,1841,9 novembre,Naissance d'Edouard VII
3937,1841,13 juillet,Signature de la convention de Londres
3938,1842,15 janvier,"Naissance de Paul Lafargue, écrivain et homme politique socialiste français."
3939,1842,10 février,Traité de Grand-Bassam entre le Grand-Bassam et la France.
3940,1842,26 février,"Naissance de Camille Flammarion, astronome français."
3941,1842,18 mars,"Naissance de Stéphane Mallarmé, poète français."
3942,1842,5 avril,Le roi d'Afghanistan Shah Shuja est assassiné.
3943,1842,1 mai,Décret de dissolution de l'Assemblée au Brésil.
3944,1842,9 août,Traité Webster-Ashburton déterminant la frontière entre le Maine et le Nouveau-Brunswick.
3945,1842,12 mai,"Naissance de Jules Massenet, compositeur français."
3946,1842,29 août,Hong-Kong devient britannique
3947,1842,décembre,Georges III Bibesco devient prince de Valachie.
3948,1842,27 novembre,Indépendance du Paraguay. Carlos Antonio López devient président.
3949,1842,22 novembre,"Naissance de José-Maria de Heredia, poète parnassien."
3950,1842,1 octobre,"Naissance de Charles Cros, poète et inventeur français."
3951,1842,21 septembre,"Naissance d'Abdülhamid II, sultan ottoman."
3952,1842,8 mai,"Décès de Jules Dumont d'Urville, explorateur."
3953,1842,29 août,Fin de la première guerre de l'Opium
3954,1842,9 septembre,Tahiti devient un protectorat français.
3955,1843,19 septembre,"Décès de Gaspard-Gustave Coriolis, mathématicien et ingénieur français."
3956,1843,11 décembre,"Naissance de Robert Koch, médecin et microbiologiste allemand."
3957,1843,23 juillet,Coup de force du général Narváez en Espagne.
3958,1843,2 juillet,"Décès de Samuel Hahnemann, fondateur de l'homéopathie."
3959,1843,18 mai,Schisme de 1843 en Écosse.
3960,1843,16 mai,Prise de la smala d'Abd el-Kader
3961,1843,16 mai,Bataille de Campêche entre les flottes du Mexique et du Texas.
3962,1843,15 avril,"Naissance d'Henry James, écrivain américain."
3963,1843,21 mars,"Décès de Guadalupe Victoria, président du Mexique."
3964,1843,8 mars,Restauration de lAlthing
3965,1843,1 mars,Début de la Grande Guerre en Uruguay.
3966,1843,8 février,Tremblement de terre à Pointe-à-Pitre.
3967,1843,6 février,"Naissance de Paul Sébillot, ethnologue français."
3968,1843,29 janvier,"Naissance de William McKinley, futur Président des États-Unis."
3969,1843,22 janvier,Première du Vaisseau Fantôme
3970,1843,,"Kierkegaard publie ""Crainte et tremblement"""
3971,1843,4 septembre,Noyade de Léopoldine Hugo et Charles Vacquerie.
3972,1843,3 septembre,Coup d'État du général Yánnis Makriyánnis en Grèce.
3973,1844,25 juillet,Exécution des frères Bandiera.
3974,1844,15 octobre,"Naissance de Friedrich Nietzsche, philosophe Allemand."
3975,1844,28 août,Rencontre entre Karl Marx et Friedrich Engels à Paris.
3976,1844,27 juin,Martyre de Joseph Smith.
3977,1844,24 octobre,Traité de commerce de Huangpu entre la France et la Chine.
3978,1844,,Emile Littré commence la rédaction de son dictionnaire
3979,1844,mars,"Dumas père publie ""les Trois mousquetaires"""
3980,1844,mars,Début de l'affaire Pritchard à Tahiti.
3981,1844,8 mars,Début du règne d'Oscar Ier de Suède et de Norvège.
3982,1844,24 octobre,Signature du traité de Whampoa
3983,1844,30 mars,"Naissance de Paul Verlaine, poète Français."
3984,1844,14 mars,Carlos Antonio López devient président de la république du Paraguay.
3985,1844,21 mai,"Naissance d'Henri (le Douanier) Rousseau, peintre Français."
3986,1844,24 mai,Morse envoie son premier télégramme
3987,1844,7 juin,Loi de fabrique (Factory Act) au Royaume-Uni.
3988,1844,15 juin,Goodyear met au point le caoutchouc
3989,1844,14 août,Bataille d'Isly.
3990,1844,16 avril,"Anatole France, homme de lettres Français."
3991,1844,14 août,Défaite de l'armée Marocaine contre la France
